SITE_SOURCE_ID;SITE_NAME;LOCALISATION;GEONAME_ID;PROJECTION_SYSTEM;LONGITUDE;LATITUDE;ALTITUDE;CITY_CENTROID;STATE_OF_KNOWLEDGE;OCCUPATION;STARTING_PERIOD;ENDING_PERIOD;MAIN_CHARAC;CHARAC_LVL1;CHARAC_LVL2;CHARAC_LVL3;CHARAC_LVL4;CHARAC_EXP;BIBLIOGRAPHY;COMMENTS;WEB_IMAGES;DUPLICATE_DB_NAME;DUPLICATE_SCORE;DUPLICATE_FLAG
drive-007addb7d769;Leang Cave;South Sulawesi;;;;;;No;Excavated;Not specified;-2580000;1950;Archaeological Sites;Cave / Gua / Liang / Ceruk;;;;No;https://doi.org/10.1016/j.jas.2019.105031 | https://doi.org/10.22459/TA48.11.2018.09 | https://doi.org/10.3406/arch.1976.1271;Description: , 286–316. Cambridge: Cambridge University Press. Forestier, Hubert. 2007. Ribuan Gunung Ribuan Alat Batu “Prasejarah Song Keplek, Gunung Sewu, Jawa Timur . Jakarta: Kepustakaan Populer Gramedia. Glover, Ian. 1976. “Ulu Leang Cave, Maros: “A Premilinary Sequance of Post Pleistocene Cultural Development in South Sulawesi.” Archipel 11: 54–113. ---------. 1978. “Survey and Excavation in The Maros District, South Sulawesi, Indonesia: The 1975 Field Jakarta: Kepustakaan Populer Gramedia, Ecole Francaise d’Extreme-Orient Institut de Recherche pour le Developpement dan Pusat Penelitian dan Pengembangan Arkeologi Nasional. Forum Jakarta-Paris. Glover, I.C. 1976. “Ulu Leang Cave, Maros: a Premilinary Sequance of post Pleistocene cultural development in South Sulawesi”.Archipel, 11: 54-113. ----------. 1978. “Survey and Excavation in The Maros District, South Sulawesi, Indonesia: The 1975 Field | Keywords: Cave;;;;
drive-ac91b62cbf6f;Leang Karassa The;South Sulawesi;;;;;;No;Not documented;Not specified;-11700;1950;Archaeological Sites;Cave / Gua / Liang / Ceruk;;;;No;https://doi.org/10.22459/TT.05.2015.12 | https://doi.org/10.1038/s41598-019-42946-9 | https://doi.org/10.1038/s41559-019-0902-6 | https://doi.org/10.1080/15564894.2021.1991056 | https://doi.org/10.1080/15564894.2021.1991056;Description: THE HOLOCENE PREHISTORY OF SOUTH SULAWESI 137 2.3. Leang Karassa The sequence at Leang Karassa, on the Patanuang Asue River in the Maros karsts (see Fig. 1), can also be loosely related to the Leang-Leang sequence. Broadly, two phases are evident, a ceramic phase excavated by Campbell Ma st partly satisfied by Pasqua's successful application of Flenniken and White's core-reduction sequence to explain the technological differences between the c. 4000 and c. 2500 year old assemblages at Leang Burung 1 and Leang Karassa. The knappers ap­ pear to have followed the same core-reduction strategy despite the typo­ logical differences comparing Leang Burung 1 (and Pammangkulang Batua) with Leang Karassa. These typological differences are precisel | Keywords: Excavated site;;;;
drive-020df4c4abef;Leang Pamelakkang Tedong;South Sulawesi;;;;;;No;Not documented;Not specified;;;Archaeological Sites;Cave / Gua / Liang / Ceruk;;;;No;https://doi.org/10.3406/arch.1976.1271 | https://doi.org/10.1016/j.jasrep.2023.103871 | https://doi.org/10.1016/j.jasrep.2023.103871;"""Description: at did not have paintings in the form of hand drawings and one cave did not have paintings. The paintings in the 6 prehistoric caves are in the form of human images in Leang Batu Tianang, Leang Karama, Leang Ulu Tedong, Leang Pamelakkang Tedong ; pictures of kangkang humans in Leang Tagari and Leang Kassi. The latest data, based on the results of the 2016 BPCB Makassar survey and the Puslitarkenas Survey and the Archaeological Department of Unhas in September sud adalah 5 gambar babi yang dilaporkan di Leang Garunggung, Pangkep (Tim Penyusun 2013, 54), yang sudah rusak atau hilang; 3 gambar lipan masing-masing pada Leang Bulu Tengngae (Maros), Leang Bulu Tianang (Maros), dan Leang Pamelakkang Tedong, Pangkep (diragukan); 1 gambar menyerupai bebek di Leang Bulu Sipong.2, Maros (diragukan); 1 gambar babi yang sudah rusak pada Leang Batanglamara, Pangkep; 1 gambar kalajengking di Leang Ulu | Keywords: Rock art site""";;;;
drive-f13820d249dd;Leang Sakapa;South Sulawesi;;;;;;No;Not documented;Not specified;-2580000;-4000;Archaeological Sites;Rockshelter / Rock shelter / Ceruk;;;;No;https://doi.org/10.3406/arch.1976.1271 | https://doi.org/10.1016/j.jasrep.2023.103871 | https://doi.org/10.1016/j.jasrep.2023.103871;"""Description: ia . Science 2018; 361: 511–516. https:// doi.org/10.11 26/science.aa r8486 PMID: 300725 39 26. Sarasin P, Sarasin F. Reisen in Celebes II. Wiesbade n: C.W. Kreidel’s Verlag; 1905. 27. Bulbeck D, Sumantr i I, Hiscock P. Leang Sakapa o 1, a second dated Pleistocen e site from South Sula- wesi, Indonesia . Mod. Quat. Res. SE Asia. 2004; 18: 111–128. 28. Glover IC. Leang Burung 2: an Upper Palaeolithic rock shelter in south Sulawesi, Indonesia . Mod. ocene habitatio n evidenc e a t Sout h Sulawes i rock shelter s (fro m Bulbec k 1996-97, 2004a, 2006; Bulbec k et al. 2000) based on radiocarbon date s ('=) or artifactual / stratigraphic evidence . Lean g Burun g 2 and Leang Sakapa o 1 , wit h evidence onl y of Pleistocene habitatio n (Bulbec k et al . 2004), are excluded . | Keywords: Rockshelter""";;;;
drive-ce39630004cf;Leang Sakapao I;South Sulawesi;;;;;;No;Not documented;Not specified;-2580000;500;Archaeological Sites;Cave / Gua / Liang / Ceruk;;;;No;https://doi.org/10.1353/asi.2000.0004;"""Description: ene stone artefacts from Goio Cave, Maluku, (a, d): flai<es; (b-c): single platform cores. Scale bars are in 10 mm increments. (After Szabo el al. in press.) I I M I I I I 1 Figure 9.23. Pleistocene stone artefacts from Leang Sakapao I, Sulawesi. Scale bars are in 10 mm increments. (After Bulbeck el al. 2004.) Peninsula from the Ice Age to the Iron Age, in Under the Canopy: the Archaeology of Tropical Rain Forests^ ed. J. Mercader. New Brunswick: Rutgers University Press, 119-160. Bulbeck, D., 1. Suniantri & P. Uiscock, 2004. Leang Sakapao I, a second dated Pleistocene site from South Sulawesi, Indonesia. Modern Oiialernary Research in Southeast Asia 18.111-128. Bunn. H., J.W.K. Harris, G. Isaac, Z. Kaufulu, E. Kroll, K. Schick, N. Toth & A.K. Behrensmeyer, | Keywords: Cave""";;;;
drive-1fa1fc0d93a0;Liang Panningnge;South Sulawesi;;;;;;No;Not documented;Not specified;-11700;1950;Archaeological Sites;Port / Harbor / Anchorage;;;;No;https://doi.org/10.1038/s41586-021-03823-6;"""Description: cip linaires Sur Le Monde Insulindien. 1976; 11:113–54. 29. Saiful MA, Anggraeni . Eksploitasi Suidae pada kala Holosen di Liang Pannininge , Maros, Sulawesi Selatan (Exploitation of Suidae during the Holocene period at Liang Panningnge , Maros, South Sula- wesi). Purbaw idya. 2019; 8(2):81–10 0. 30. Bulbeck D, Simons A. Late Quaternar y faunal successio ns in South Sulawesi, Indonesia . Mod Quart Res SE Asia. 2004; 18:167–9 0. 31. Meijaard E, Groves C i, kajian Arkeologi pada situs gua Panningn ge di kecamatan Mallawa, kabupate n Maros [internal report]. Universitas Hasanuddin .: Fakultas Ilmu Budaya,; 2018. 125. Saiful MA. Suidae dalam strategi subsisten si penghuni Liang Panningnge , Maros, Sulawesi Selatan. M.A. Thesis, Univers itas Gadjah Mada; 2019. 126. Balar Sul-Sel, Unhas, USM Researc h Team. Lapora n Ekskavasi Liang Panningn ge. Unpublishe d report. (Tim Penelitian Kerja Sama U | Keywords: Cave""";;;;
drive-5312a29116ef;Liang Uttange;South Sulawesi;;;;;;No;Not documented;Not specified;-11700;1950;Archaeological Sites;Quarry / Raw material source / Obsidian source / Chert source;;;;No;https://doi.org/10.1016/j.jhevol.2006.08.011 | https://doi.org/10.1080/15564894.2022.2108947.] | https://doi.org/10.5281/zenodo.3929274;"""Description: 337 Figure 13: Examples of stone artifacts recovered from layer 2 of Liang Uttange 1 that mark the mid-Holocene Toalean signature. Far left, geometric microliths (square U15 B18, spit 2); center, Maros point (square U15 B18, spit 4); right of center, flake (square U15 B18, spit 4); and far right, blad 344 Figure 20: Polished (teknik gosok atau asah) shell ornament from Liang Uttange, U6 B18 square, spit 4, layer 2, dated to ca. 3000 BP (source Balai Arkeologi Sulawesi Selatan, 2018). Figure 21: Bone artifact from Liang Uttange, U6 B18 square, spit 4, layer 2 with two symmetrically positioned holes, | Keywords: Excavated site""";;;;
drive-5d52b18267d3;Painted Caves;South Sulawesi;;;;;;No;Not documented;Not specified;-2580000;-4000;Archaeological Sites;Cave / Gua / Liang / Ceruk;;;;No;https://doi.org/10.22459/TA48.11.2018 | https://doi.org/10.22459/TA47.11.2017 | https://doi.org/10.30883/jba.v42i1.979 | https://doi.org/10.1002/(SICI;"""Description: adas tersebut. Daftar Pustaka Aubert, M et al. 2014. “Pleistocene Cave Art from Sulawesi, Indonesia”. Nature 514: 223-227. Clottes, Jean and David Lewis-Williams. 1996. The Shamans of Prehistory: Trance and Magic in the Painted Caves . New York: Harry N. Abrams. Eriawati, Yusmaini. 2003. Album Seni Budaya; Lukisan di Gua-Gua Karst Maros-Pangkep Sulawesi Selatan; Gambaran Penghuni dan Matapencahariannya. Jakarta: Deputi Bidang Pelestarian dan Pengemb . Clottes , J. , 1990 L ’ art des objets au pal é olithique . Foix - Le Mas - d ’ Azil, 1987, Minist è re de la Culture. Clottes , J. , and Lewis - Williams , D. , 1998 The Shamans of Prehistory: Trance and Magic in the Painted Caves . New York : Harry N. Abrams . Conkey , M.W. , 1978 Style and Information in Cultural Evolution: Toward a Predictive Model for the Paleolithic . In Social Archaeology: Beyond Subsistence and Dating . C.L. Redman | Keywords: Cave""";;;;
drive-57c99720b704;Ulu Leang Cave;South Sulawesi;;;;;;No;Excavated;Not specified;-2580000;1950;Archaeological Sites;Cave / Gua / Liang / Ceruk;;;;No;https://doi.org/10.1016/j.jas.2019.105031 | https://doi.org/10.22459/TA48.11.2018.09 | https://doi.org/10.3406/arch.1976.1271;Description: liam, 286–316. Cambridge: Cambridge University Press. Forestier, Hubert. 2007. Ribuan Gunung Ribuan Alat Batu “Prasejarah Song Keplek, Gunung Sewu, Jawa Timur . Jakarta: Kepustakaan Populer Gramedia. Glover, Ian. 1976. “Ulu Leang Cave, Maros: “A Premilinary Sequance of Post Pleistocene Cultural Development in South Sulawesi.” Archipel 11: 54–113. ---------. 1978. “Survey and Excavation in The Maros District, South Sulawesi, Indonesia: The 1975 Field ur . Jakarta: Kepustakaan Populer Gramedia, Ecole Francaise d’Extreme-Orient Institut de Recherche pour le Developpement dan Pusat Penelitian dan Pengembangan Arkeologi Nasional. Forum Jakarta-Paris. Glover, I.C. 1976. “Ulu Leang Cave, Maros: a Premilinary Sequance of post Pleistocene cultural development in South Sulawesi”.Archipel, 11: 54-113. ----------. 1978. “Survey and Excavation in The Maros District, South Sulawesi, Indonesia: The 197 | Keywords: Surveyed site;;;;
drive-0a7edcad2f1b;Ceruk Lakan Taghu;Southeast Sulawesi;;;;;;No;Not documented;Not specified;;;Archaeological Sites;Rockshelter / Rock shelter / Ceruk;;;;No;;Description: 6. Hand stencils and boats in the painted rock art of the karst region of Muna Island, Southeast Sulawesi 71 terra australis 48 Figure 6.13: Ceruk Lakan Taghu (top) and some of its rock paintings (below). Source: Oktaviana (2016). The right-side terrace is a 2 m high corridor that penetrates the karst at this point. Various paintings can be found here, including an external c the Bandung Institute of T echnology. These observations documented the parietal art of various caves and caverns, including Gua Metanduno, Gua Kabori, Ceruk Ida Malangi, Gua Sugi Patani, Ceruk La Podo, Gua Pominsa and Ceruk Lakan Taghu (Figure 6.2). A review of the literature was done to contextualise these observations with those from earlier texts relating to the prehistoric art in the Muna Island karsts, including Kosasih (1987, 1989, 1995) and BCP | Keywords: Rock art site;;;;
drive-51d2670001b3;Gua Anawai;Southeast Sulawesi;;;;;;No;Not documented;Not specified;;;Archaeological Sites;Cave / Gua / Liang / Ceruk;;;;No;https://doi.org/10.30883/jba.v40i2.518 | https://doi.org/10.30883/jba.v30i1.385 | https://doi.org/10.30883/jba.v41i2.855 | https://doi.org/10.24164/pnk.v2i1.21;Description: round 40,000 years ago), 18 sites with hand stencils and APT motifs, and a remainder of four entirely APT sites. In Southeast Sulawesi Province, hand stencils have been encountered only occasionally, specifically at the Gua Anawai site in the Matarombeo Massif (Oktaviana et al. 2016), and at three sites (all of them dominated by APT paintings) on Muna Island (Oktaviana, this volume). Gua Pondoa, one of the three Matarombeo Massif APT sites referr 76 Budianto Hakim, Lukisan Cap tangan Prasejarah di Kawasan Batu Ejaya Gambar 1: Lukisan cap tangan di situs Gua Anawai, Sultra (dok. Luc-Henri Fage, 2014) Gambar 2: Cap Tangan di Gua Tewet, Kaltim (dok. Luc- Henri Fage, 2014) Hasil penelitian melaporkan bahwa sebaran lukisan di Sulawesi Selatan bukan hanya terbatas di daerah Maros, Pang | Keywords: Rock art site;;;;
drive-a84876fcd638;Gua Batu Cincin;Southeast Sulawesi;;;;;;No;Not documented;Not specified;;;Archaeological Sites;Cave / Gua / Liang / Ceruk;;;;No;https://doi.org/10.30883/jba.v40i2.518 | https://doi.org/10.30883/jba.v30i1.385 | https://doi.org/10.30883/jba.v41i2.855 | https://doi.org/10.24164/pnk.v2i1.21;"""Description: site do not appear to be similar to each other and may not have been part of the same painting episode. However, the black paintings are reminiscent of rock paintings in Huashan Mountain in Guangxi Province, China, and Gua Batu Cincin in Kelantan, Malaysia. The age of these paintings is uncertain. When asked, locals did not know the origin or the antiquity of these paintings. A tour guide felt conﬁ dent that they were images created as part of offeri ed; however, it remains to be seen if the two artefact types are related. In the eastern state of Kelantan, two pairs of charcoal rock art sites are known in the vicinity of Kuala Betis and Kuala Bering. At Kuala Betis, Gua Batu Cincin is a semicircular cave containing 53 figurines on 27 panels, the majority of which depict anthropomorphs in a “dancing posture with upraised arms” [78,88]. Nearby, Gua Kambing contains representations of anthr | Keywords: Rock art site""";;;;
drive-1d7a0ba53742;Gua Kabori;Southeast Sulawesi;;;;;;No;Not documented;Not specified;;;Archaeological Sites;Rockshelter / Rock shelter / Ceruk;;;;No;https://doi.org/10.30883/jba.v40i2.518 | https://doi.org/10.30883/jba.v30i1.385 | https://doi.org/10.30883/jba.v41i2.855 | https://doi.org/10.24164/pnk.v2i1.21;Description: ock art contained within this region was first documented by Indonesia’s National Research Centre for Archaeology in 1977, with further studies in 1984 and 1986 (Kosasih 1985, 1989, 1995). The 10 sites of Gua Metanduno, Gua Kabori, Gua Wa Bose, Gua T oko, Gua La Kolumbu, Ceruk Ida Malangi, Ceruk Lasabo A, Ceruk Lasabo B, Ceruk La Nsafora and Ceruk Tangga Ara were recorded for a variety of motifs including anthropomorphs, zoomorphs, sun and boat m observations of negative hand stencils on Muna Island were made at Gua Pominsa by the Makassar Archaeology Office. In 2015, more negative hand stencils were recorded at two further Muna Island sites (Gua Mentanduno and Gua Kabori) by the Directorate of Cultural Property Preservation and Museums, and in 2016 a new site with parietal art (Gua Lakan Taghu) was discovered. Analysis of the Muna Island boat imagery documents the depiction of five prop | Keywords: Rock art site;;;;
drive-4076cd77a0f6;Gua Kuya;Southeast Sulawesi;;;;;;No;Not documented;Not specified;;;Archaeological Sites;Burial / Cemetery / Kubur / Makam;;;;No;https://doi.org/10.30883/jba.v40i2.518 | https://doi.org/10.30883/jba.v30i1.385 | https://doi.org/10.30883/jba.v41i2.855 | https://doi.org/10.24164/pnk.v2i1.21;Description: N ARKEOLOGI PADA GUA KUYA DI DESA PONDOA KECAMATAN WIWIRANO KABUPATEN KONAWE UTARA PROVINSI SULAWESI TENGGARA Wa Ode Ato, Abdul Alim, Salniwati Jurusan Arkeologi Universitas Halu Oleo waodeato1998@gmail.Com ABSTRACK The Gua Kuya site is a prehistoric site that has various archaeological remains of ancient humans at that time. Based on the problem formulation of this r esearch, they are: (1) What are the archaeological remains found in Kuya Cave molars, 8 types of canines, 1 type of incisor, also found 2 beads, namely bracelets and necklace beads, and 2 types of mollusk fragments or seashells. As for the function of the Kuya Cave Site, based on the remains, the Gua Kuya Site was once a residential cave and turned into a burial cave. Keywords: Kuya Cave Site, Archaeological Remains, North Konawe ABSTRAK Situs Gua Kuya merupakan situs prasejarah yang memiliki berbagai ting galan–tinggalan a | Keywords: Cave;;;;
drive-48785f0cc425;Gua Lampetia;Southeast Sulawesi;;;;;;No;Excavated;Not specified;-11700;1950;Archaeological Sites;Quarry / Raw material source / Obsidian source / Chert source;;;;No;https://doi.org/10.30883/jba.v40i2.518 | https://doi.org/10.30883/jba.v30i1.385 | https://doi.org/10.30883/jba.v41i2.855 | https://doi.org/10.24164/pnk.v2i1.21;Description: enth to fourteenth centuries AD (Chinese martavans’ chronology) Source: Calibration (95.4 per cent confidence interval) undertaken by the author using Oxcal 4.2 (Bronk Ramsey 2014). In Southeast Sulawesi, excavations at Gua Lampetia cave yielded a single jar similar to the Sabbang Loang jars (Figure 8.3), but up to a millennium later, based on the thermoluminescence dates of AD 1140±60 for the jar and 1050±120 for the cover. The ca. 60 cm tall jar, 150 New Perspectives in Southeast Asian and Pacific Prehistory terra australis 45 Figure 8.3 Large earthenware burial jar at Gua Lampetia sketched by Ambra Calo after its exposure in test pit. Source: Photograph Jack Fenner, published here with his kind permission. Lambanupa, also on Sumba, contained burial jars 30–70 cm in height and 20–30 cm in diameter | Keywords: Burial site;;;;
drive-11bd2e8d6922;Gua Lampetia Certainly;Southeast Sulawesi;;;;;;No;Not documented;Not specified;;;Archaeological Sites;Shipwreck / Underwater / Maritime site;;;;No;https://doi.org/10.30883/jba.v40i2.518 | https://doi.org/10.30883/jba.v30i1.385 | https://doi.org/10.30883/jba.v41i2.855 | https://doi.org/10.24164/pnk.v2i1.21;Description: atujaya, West Java (on current data) Beach/coastal jar burials associated with direct inhumations Reflects maritime connections along north Java/Bali Sulawesi large jars Southwest and Southeast Sulawesi ca . AD 200–1200 Gua Lampetia Certainly in Southeast Sulawesi Large earthenware jars, sometimes in fields Three included sites may be independent developments atujaya, West Java (on current data) Beach/coastal jar burials associated with direct inhumations Reflects maritime connections along north Java/Bali Sulawesi large jars Southwest and Southeast Sulawesi ca . AD 200–1200 Gua Lampetia Certainly in Southeast Sulawesi Large earthenware jars, sometimes in fields Three included sites may be independent developments This content downloaded from 194.47.65.106 on Thu, 05 Jan 2023 13:26:18 UTC | Keywords: Burial site;;;;
drive-4b1b3579a791;Gua Pondoa;Southeast Sulawesi;;;;;;No;Not documented;Not specified;-11700;1950;Archaeological Sites;Cave / Gua / Liang / Ceruk;;;;No;https://doi.org/10.22459/TA48.11.2018.07 | https://doi.org/10.2752/175169713X13500468476600;Description: 7. Black drawings at the cave site of Gua Pondoa, Southeast Sulawesi 87 terra australis 48 a short distance to the north of Maros. Similarities with Gua Pondoa include motifs of boats, one with six passengers linked arm to arm, other human figures in dynamic pose and/ 7. Black drawings at the cave site of Gua Pondoa, Southeast Sulawesi 91 terra australis 48 Bulbeck, D. 2010. Uneven development in Southwest Sulawesi, Indonesia during the Early Metal Phase. In B. Bellina, E.A. Bacus, T .O. Pryce and J.W . Christie (eds), 50 Years of | Keywords: Cave;;;;
drive-1b250f16935d;Gua Sambagowala;Southeast Sulawesi;;;;;;No;Excavated;Not specified;-2580000;1950;Archaeological Sites;Cave / Gua / Liang / Ceruk;;;;No;https://doi.org/10.30883/jba.v40i2.518 | https://doi.org/10.30883/jba.v30i1.385 | https://doi.org/10.30883/jba.v41i2.855 | https://doi.org/10.24164/pnk.v2i1.21;Description: st Sulawesi, Indonesia David Bulbeck1,*, Sue O ’Connor1,2, Fakhri3, Jack N. Fenner 1, Ben Marwick4, Suryatman3, Fadhila Aziz 5, Budianto Hakin 3 & Unggul P. Wibowo 6 Excavations of pre-pottery levels at Gua Talimbue and Gua Sambagowala in South- east Sulawesi, Indonesia, have yielded nearly 4kg of baked-clay fragments, half of which exhibit intentional patterning. The fragments appear to derive from clay hearths. Here, the authors link the patterning cavations of late Pleistocene/early Holocene sites on the island of Sulawesi have yielded bigger bone point assemblages. Together with Topogaro (n = 113), the sites of Gua Talimbue (n = 95), Gua Mo ’ ohono (n = 49), and Gua Sambagowala (n = 5) in the Walan - dawe region, Southeast Sulawesi have produced osseous artefacts, mostly unipoints (n = 53) and bipoints (n = 27), dated between 9.5 and 3.4 ka ( Aplin et al., 2016 ). Ulu Leang 1 and Lea | Keywords: Excavated site;;;;
drive-b8fd4036dd52;Gua Sambangoala;Southeast Sulawesi;;;;;;No;Not documented;Not specified;-2580000;1950;Archaeological Sites;Cave / Gua / Liang / Ceruk;;;;No;https://doi.org/10.1353/asi.2016.0017 | https://doi.org/10.22459/TA48.11.2018.09;Description: 10. Vertebrate fauna from Gua Sambangoala, Southeast Sulawesi 169 terra australis 48 Bulbeck, D., S. O’Connor and Fakhri. 2015. Decorated and plain baked clay from the initial to the late Holocene at Gua Talimbue, Southeast Sulawesi, Indonesia. Presentation at 158 The Archaeology of Sulawesi terra australis 48 Research methods Data collection The excavation of Gua Sambangoala proceeded using spits of 5 cm and 10 cm depths within a 1 m x 1 m square (T est Pit A), with the deposit sieved using a 1.5 mm mesh. Analysis and methods The excavated osteological remains were identified to the lowest | Keywords: Excavated site;;;;
drive-43cef2a29d1f;Liang Datu;Southeast Sulawesi;;;;;;No;Not documented;Not specified;-11700;1950;Archaeological Sites;Burial / Cemetery / Kubur / Makam;;;;No;https://doi.org/10.1016/j.jhevol.2006.08.011 | https://doi.org/10.1080/15564894.2022.2108947.] | https://doi.org/10.5281/zenodo.3929274;Description: Marengok Papaling 700±40 Beta-274729 Boat (coffin) Closed Mortuary Duli 2013 Puang Leoran 700±40 Beta-274730 Boat (coffin) Closed Mortuary Duli 2013 Buttu Mila 570±40 Beta-274733 Boat (coffin) Closed Mortuary Duli 2013 Liang Datu 470±40 Beta-274734 Boat (coffin) Closed Mortuary Duli 2013 Table A8.5: Accepted Holocene radiometric determinations from Southeast Sulawesi (all Carbon-14 unless otherwise stated). Site Date BP Laboratory code Dated mat Limbong 41: Allak Angin-Angin 42: Lo’kok Pongdadu 43: Se’pon Marinding 44: Pangki Mangke’pek 45: Palak Tokkek 46: Potok Tengan Kando 47: Tok Sempa 48: Kaluppini 50: Marengok Papaling 49: Puang Leoran 51: Buttu Mila 52: Liang Datu 11: Palemba 53: Gua Lampetia 54: Gua Talimbue 55: Gua Mo’o hono 56: Gua Sambangoala 57: Gua Tengkorak 65: Leang Karassak 66: Gua Batti 67: Lamuru 68: Bayoa 1 69: Bonto-Bontoa 70: Galesong 71: Sanrabone 72: Batu Ejayya 7 | Keywords: Karst;;;;
drive-1b7e00748886;Bukit Tiwing Leang Buida;Sulawesi;;;;;;No;Excavated;Not specified;;;Archaeological Sites;Quarry / Raw material source / Obsidian source / Chert source;;;;No;https://doi.org/10.3406/arch.1976.1271 | https://doi.org/10.1016/j.jasrep.2023.103871 | https://doi.org/10.1016/j.jasrep.2023.103871;Description: ae 0 0 4 (1) 0 0 0 0 0 4 (1) 8 Muraenidae 0 0 0 0 1 0 0 0 1 8 Holocentridae 0 0 0 1 0 0 0 0 1 8 Labridae 0 0 0 0 0 1 0 0 1 Total 1 2 21 6 6 3 0 0 39 (25) Source: Rintaro Ono. T errestrial resource use at Leang Buida and Bukit Tiwing Leang Buida produced 409 NISP of mammal, bird and sea turtle remains, and over 80% of them were unearthed from Layers 2 and 3 (Table 15.11). Although the total number and volume of animal remains is limited, the available identific unger, but it is so far the first excavated case of a clay spindle whorl in the Sangihe-Talaud Islands. Marine resource use in Leang Buida and Bukit Tiwing Fish and shell remains were excavated from both Leang Buida and Bukit Tiwing. Leang Buida produced the larger Numbers of Individual Specimens (NISP): 21,487 NISP of shell remains (about 50 kg) and 356 NISP of fish remains. Bukit Tiwing produced only 3,301 NISP of shell remains a | Keywords: Excavated site;;;;
drive-b4d1618219fe;Burung Cave;Sulawesi;;;;;;No;Not documented;Not specified;-4000;-350;Archaeological Sites;Cave / Gua / Liang / Ceruk;;;;No;https://doi.org/10.1080/15564894.2020.1868631 | https://doi.org/10.1080/15564894.2020.1868631 | https://doi.org/10.1088/1742-6596/1341/3/032047 | https://doi.org/10.1088/1742-6596/1341/3/032047;"""Description: PI. 59. Rock -painting in red striped-line technique of a charging boar. PattaE Cave, East of Maros, Southwest Celebes. PI. 61. Negativ e hand-stencil on a red background. Burung Cave , East of Maros, Southwest Celebes . ogeneity"""" and """"lack of stratification"""" in so many Sulawesi cave deposits ; comments which are repeatedly made by van Heekeren (e.g. 1972 : 108 111, 112, 123). Van Heekeren discusses, in detail, only the cemented band at Burung Cave, but in his latest publication he implies that they are not uncommon, """"on the walls of caves we sometimes saw cemented shell banks 50-100 cm above the present surface caused by water containing lime dripping this layer | Keywords: Cave""";;;;
