SITE_SOURCE_ID;SITE_NAME;LOCALISATION;GEONAME_ID;PROJECTION_SYSTEM;LONGITUDE;LATITUDE;ALTITUDE;CITY_CENTROID;STATE_OF_KNOWLEDGE;OCCUPATION;STARTING_PERIOD;ENDING_PERIOD;MAIN_CHARAC;CHARAC_LVL1;CHARAC_LVL2;CHARAC_LVL3;CHARAC_LVL4;CHARAC_EXP;BIBLIOGRAPHY;COMMENTS;WEB_IMAGES;DUPLICATE_DB_NAME;DUPLICATE_SCORE;DUPLICATE_FLAG
drive-82cdad33d237;Jerimalai Cave;Flores;;;;;;No;Not documented;Not specified;-2580000;1950;Archaeological Sites;Rockshelter / Rock shelter / Ceruk;;;;No;https://doi.org/10.1080/15564894.2020.1868631 | https://doi.org/10.1080/15564894.2020.1868631 | https://doi.org/10.1088/1742-6596/1341/3/032047 | https://doi.org/10.1088/1742-6596/1341/3/032047;Description: . Since the site was occupied by Homo floresiensis, we need more solid data to confirm when this early human species disappeared or was replaced by modern humans in Flores. On the other hand, Asitau Kuru, formerly named Jerimalai Cave, located along the eastern coast of East Timor ( Figure 1) is one the oldest prehistoric sites left by modern humans and is dated to 42-38 ka [3]. There is no direct fossil evidence of modern humans in Asitau Kuru, thou d a human presence with large pebble tools by 30–24 kya in the Lua Meko rock shelter on Rote Island. There is no sign so far in Timor of any hominin occupation prior to the arrival of Homo sapiens. The first settlers in Jerimalai Cave made a good living from the sea, with many bones initially claimed to be of fast‐swimming pelagic fish such as tuna accounting for more than 50% of all fishbone in the lower layers. These were dated from associ | Keywords: Cave;;;;
drive-19425655a763;Liang Bua;Flores;;4326;120.444;-8.531;;No;Not documented;Not specified;-2580000;1950;Archaeological Sites;Cave / Gua / Liang / Ceruk;;;;No;https://doi.org/10.1016/j.jasrep.2021.103199 | https://doi.org/10.1016/j.jasrep.2021.103199 | https://doi.org/10.7152/jipa.v44i0.15675 | https://doi.org/10.1016/j.jhevol | https://doi.org/10.1016/j.jhevol | https://doi.org/10.1126/science.1193130 | https://doi.org/10.1016/j.jhevol.2006.08.002 | https://doi.org/10.1016/j.jhevol.2008.10.006 | https://doi.org/10.1016/j.jhevol.2008.08.015 | https://doi.org/10.1016/j.jhevol.2008.08.015 | https://doi.org/10.1073/pnas.1516186113 | https://doi.org/10.1016/j.jhevol.2008.10.006 | https://doi.org/10.1016/j.jhevol.2009.07.003 | https://doi.org/10.1038/nature04022 | https://doi.org/10.1016/j.jhevol.2018.07.001;"""""""Description: On October 28, 2004, came the startling announcement that the remains of a tiny little humanlike creature had been found in Late Pleistocene deposits in Liang Bua, a cave on the island of Flores in Nusatenggara. It was a joint Indonesian-Australian discovery: Thomas Sutikna of the Indonesian Centre for Archaeology in Jakarta, Mike Morwood, of the University of New England in Armidale (New South Wales), and their teams. The new species was represented by a nearly complete adult skeleton, Liang Bua 1, and the isolated lower premolar of a second individual, LB2. LB1 was found at a level dated to approximately 18,000 BP; LB2 was much older. The detailed description of the remains, and the description and naming of the new species Homo floresiensis, was by the renowned palaeoanthropologist Peter Brown. | Keywords: Homo Floresiensis """"""";;;;
drive-aa0bba4481fe;Liang Bua Faunal Remains;Flores;;;;;;No;Not documented;Not specified;;;Archaeological Sites;Cave / Gua / Liang / Ceruk;;;;No;https://doi.org/10.1016/j.jhevol.2008.08.015;Description: 13):4826 –31. doi: 10.1073/ pnas.1320412111 van den Bergh, G. D., H. J. M. Meijer, R. D. Awe, M. J. Morwood, K. Szab /C19o, L. W. van den Hoek Ostende, T. Sutikna, E. P. Saptomo, P. J. Piper, and K. M. Dobney. 2009. The Liang Bua Faunal Remains: A 95k.yr. sequence from Flores, East Indonesia. Journal of Human Evolution 57 (5):527 –37. doi: 10.1016/j.jhevol.2008.08.015 Wattimena, L. 2017. Kosmologi Habo Tetear orang Kei [Cosmology of ‘Habo Tetear ’ of the Kei p;;;;
drive-e2e3b42c552f;Liang Bua Homo;Flores;;;;;;No;Not documented;Not specified;-2580000;-11700;Archaeological Sites;Cave / Gua / Liang / Ceruk;;;;No;https://doi.org/10.30883/jba.v26i2.936 | https://doi.org/10.30883/jba.v26i2.936 | https://doi.org/10.1016/j.jhevol.2006.08.011 | https://doi.org/10.1080/15564894.2022.2108947.] | https://doi.org/10.5281/zenodo.3929274;Description: Homo floresiensis at Liang Bua in Indonesia. Nature 532, 366–369 (2016). 11. Détroit, F . et al. A new species of Homo from the Late Pleistocene of the Philippines. Nature 568, 181–186 (2019). 12. Brown, P . & Maeda, T. Liang Bua Homo floresiensis mandibles and mandibular teeth: a contribution to the comparative morphology of a new hominin species. J. Hum. Evol. 57, 571–596 (2009). 13. Argue, D., Groves, C. P ., Lee, M. S. Y . & Jungers, W . L. The a d metrical analysis of the crania, mandibles and dentitions of a prehistoric Australian human population. Terra Australis, 13. Canberra: Department of Prehistory, Australian National University. Brown P , Maeda T. 2009. Liang Bua Homo floresiensis mandibles and mandibular teeth: A contribution to the comparative morphology of a new hominin species. J Hum Evol 57:571–596. Brown P , Sutikna T, Morwood MJ, Soejono RP , Jatmiko Wayhu Saptomo E, | Keywords: Surveyed site;;;;
drive-2909a0960f82;Liang Bua La;Flores;;;;;;No;Not documented;Not specified;;;Archaeological Sites;Workshop / Production / Smelting / Furnace / Slag;;;;No;https://doi.org/10.1016/j.jhevol.2006.08.011 | https://doi.org/10.1080/15564894.2022.2108947.] | https://doi.org/10.5281/zenodo.3929274;"""Description: datations Argon et par traces de fission pour le niveau cendreux d’origine volcanique contextualisant les fossiles retrouvés et des datations U- series et ESR sur les dents fossilisées. 4.2. Artefacts et petits hommes à Liang Bua La découverte de Homo floresiensis à Liang Bua (Brown et al. 2004; Morwood et al. 2004) offre la possibilité d’étudier les productions lithiques de cette espèce humaine endémique de Flores, considérée comme une descendance""";;;;
drive-90e3cbb632ef;Liang Momer;Flores;;;;;;No;Not documented;Not specified;-11700;1950;Archaeological Sites;Cave / Gua / Liang / Ceruk;;;;No;https://doi.org/10.1016/j.jhevol.2006.08.011 | https://doi.org/10.1080/15564894.2022.2108947.] | https://doi.org/10.5281/zenodo.3929274;"""Description: 1989 Andaman Island Modern Andaman Islands (13) Recent Howells, 1973, 1989 Hoekgrot ca. 3000 Java, Indonesia (14) Holocene Storm, 1995 Melolo ca. 2000 Sumba, Indonesia (15) Holocene Bulbeck, pers. comm.; Bellwood, 2017 Liang Momer 7000 e4000 Flores, Indonesia (16) Holocene Storm, 1995, Van der Plas, 2007 Liang Toge ca. 7000 e4000 Flores, Indonesia (17) Holocene Jacob, 1967; Storm, 1995; Van der Plas, 2007 Tron Bon Lei-B ca.12,000 Alor, Indonesia 1989 Andaman Island Modern Andaman Islands (13) Recent Howells, 1973, 1989 Hoekgrot ca. 3000 Java, Indonesia (14) Holocene Storm, 1995 Melolo ca. 2000 Sumba, Indonesia (15) Holocene Bulbeck, pers. comm.; Bellwood, 2017 Liang Momer 7000e4000 Flores, Indonesia (16) Holocene Storm, 1995, Van der Plas, 2007 Liang Toge ca. 7000 e4000 Flores, Indonesia (17) Holocene Jacob, 1967; Storm, 1995; Van der Plas, 2007 Tron Bon Lei-B ca.12,000 Alor, Indonesia ( | Keywords: Excavated site""";;;;
drive-cbd8bd24d2bf;Liang Panas;Flores;;;;;;No;Excavated;Not specified;-11700;1950;Archaeological Sites;Burial / Cemetery / Kubur / Makam;;;;No;https://doi.org/10.1016/j.jhevol.2006.08.011 | https://doi.org/10.1080/15564894.2022.2108947.] | https://doi.org/10.5281/zenodo.3929274;"""Description: the most complete and best studied pygmoid skeleton from the Mesolithic of Indonesia. More human skeletal remains were found by Verhoeven in the Liang Momer, 5 km. north-east of Labuhanbadjo, West Flores (five burials), Liang Panas at Longgo Dalang, Manggarai, 20 km. east of Labuhan­ badjo, West Flores (cranial bones, isolated teeth, costae, vertebrae, clavicle, humerus, ulna, radius and metacarpals, os coxae, femur, pa­ tella, tibia, tarsals and in the cave of Liang Toge, from where the mammalian findings were analysed by Hooijer (1957; 1967; Heekeren 1972) and the human bones and crania by Jacob (1967). Verhoeven excavated in Liang Momer in western Flores; in Liang Panas at Longgo Dalang, Manggarai; in Gua Ala south of Liang Momer; at Aimere open site; and in the caves of Liang Baja, Liang Boto, Liang Bua and Liang Rundung. Van Heekeren also undertook some excavations in Liang Rundung. | Keywords: Excavated site""";;;;
drive-b5530b50376d;Liang Rundung;Flores;;;;;;No;Literature;Not specified;-4000;-350;Archaeological Sites;Rockshelter / Rock shelter / Ceruk;;;;No;https://doi.org/10.1016/j.jhevol.2006.08.011 | https://doi.org/10.1080/15564894.2022.2108947.] | https://doi.org/10.5281/zenodo.3929274;"""Description: the parietal, frontal, temporal, occipital bones, maxilla, mandible and teeth) ; Liang X 8 km. from Reo in the northern part of West Flores (skull, teeth and infra­ cranial bones; Liang Badjo, Liang Boto, Liang Bua and Liang Rundung (a few fragmentary skeletal remains). In all the above­ mentioned caves and rock-shelters an unspecialized flake industry was unearthed together with the skeletal remains. All caves had shallow deposits and unstratified 2 :141) who remarks on the Pre- Neolithic site of Liang Toge in Western Flores: “Special mention must be made of the absence of obsidian as used in other caves on Flores”. In van Heekeren ’s (1972:146) own excavation of Liang Rundung in north-central Flores, again predominantly Pre- Neolithic in age, he notes the presence of obsidian among the raw materials (see also Smith et al., 1977:186). Obsidian ﬂakes were collected in the hills inland fr | Keywords: Rockshelter""";;;;
drive-448961f61296;Liang Toge;Flores;;;;;;No;Not documented;Not specified;-2580000;1950;Archaeological Sites;Cave / Gua / Liang / Ceruk;;;;No;https://doi.org/10.1016/j.jhevol.2006.08.011 | https://doi.org/10.1080/15564894.2022.2108947.] | https://doi.org/10.5281/zenodo.3929274;Description: ly all assumed to originate from the Holocene period. The more complete prehistoric Indonesian skulls considered and compared with the Wajak skulls stem from Java (Hoekgrot and Sampung- H) and Flores (Liang Momer-E and Liang Toge). For com­ parison, the skull fragments from the following regions are added in the Tables: Java (Gua Kecil and Gua Jimbe), Malaysia (Gua Kepah) and Flores (Aimere and Gua Alo). Fig. 5A. Sites of the prehistoric skulls - III - - - - - II I - - - - - 1 2 4 3 2 The pierced Nautilus shell beads (P1.6:32) are different from all the others found in Timor in that they have two holes, not one. They look identical to one found by Verhoeven at Liang Toge, Flores (van Heekeren 19675158) and they can also be compared with the three hole bead, probably of Nautilus, from Sodong cave, Puger, Java (van Heekeren 1957a:P1•26b). | Keywords: Excavated site;;;;
drive-63a26adfe073;Liang X;Flores;;;;;;No;Not documented;Not specified;-11700;1950;Archaeological Sites;Cave / Gua / Liang / Ceruk;;;;No;https://doi.org/10.1016/j.jhevol.2006.08.011 | https://doi.org/10.1080/15564894.2022.2108947.] | https://doi.org/10.5281/zenodo.3929274;"""Description: Site in mainland Penang, Malaysia Mesolithic–Neolithic Callenfels, 1936; Mijsberg, 1940 Matsumura and Hudson, 2005 Mesolithic Flores Flores Island, Indonesia Mesolithic, c.7000–4000 bp Sites of Liang Momer, Linag Toge, Liang X, Gua Alo, Aimere, Sampung and Gua Nempong (Jacob 1967) Matsumura and Pookajorn, 2005 Weidun and Songze Site in Jiangsu Prov., South China Neolithic (Majiabang Culture, c.7000–5000 bp) Chang, 1986; Nakahashi and Li, 2002 s in the Wallacean islands. Several AMH remains dated to the Holocene have been documented in Flores. In the 1950s, Verhoeven excavated twelve individuals from the sites of Liang Toge, Liang Momer, Liang Panas, Gua Alo, Liang X and Aimere (Van der Plas, 2007) . The human remains from Flores show a decrease in stature and tooth size among the different individuals, with Liang Momer and Liang Panas individuals being taller (by almost 10cm) than | Keywords: Cave""";;;;
drive-9517fb6d4a67;Rundung Cave;Flores;;;;;;No;Excavated;Not specified;-11700;1950;Archaeological Sites;Rockshelter / Rock shelter / Ceruk;;;;No;https://doi.org/10.1080/15564894.2020.1868631 | https://doi.org/10.1080/15564894.2020.1868631 | https://doi.org/10.1088/1742-6596/1341/3/032047 | https://doi.org/10.1088/1742-6596/1341/3/032047;Description: 146 TUE STONE AGE OF INDONESlA My own explorations on a small scale on Flores from March to May 1952 were concemed with the excavation of two small rock­ shelters. The first one was called the Rundung Cave, situated near Wangka on a coral reef bank elevated 400 to 500 m. above the sea, Riung district in north-central Flores. The debris, again, was not thick enough to disclose any stratigraphical data: from top to bottom i merous caves and rock-shelters in West Flores.133 . My own explorations in the same area (March-May 1952) were concerned with the excavation of two sm all rock-shelters. The first and most im­ portant one was called the Rundung Cave, situated near Wangka, Riung district. A great number of flakes and same blades of a semi-microlithic character, with a minimum amount of dressing, made from chert and obsidian, wcre collected. Many of them showed a dis | Keywords: Excavated site;;;;
drive-e70ba19014ad;Soki Cave;Flores;;;;;;No;Not documented;Not specified;-2000000;1950;Archaeological Sites;Quarry / Raw material source / Obsidian source / Chert source;;;;No;https://doi.org/10.1080/15564894.2020.1868631 | https://doi.org/10.1080/15564894.2020.1868631 | https://doi.org/10.1088/1742-6596/1341/3/032047 | https://doi.org/10.1088/1742-6596/1341/3/032047;"""Description: adelets found showed very poor workmanship. A shapeless piece of bronze was found at a depth of 49 cm. amid some stone flakes. A single potsherd came from a depth of 20 cm. another from 33 cm. Like the Rundung Cave, the Soki Cave yielded a number of base-stepped stone projectile points at an average depth of 55.0 cm. Flat-based cores and crude blades are irregularly shaped and flaked in all directions. In general the flakes from the lower horizo quartzite and obsidian; we found among others a lozenge-shaped pen­ dant of mother-of-pearl and another of shell in the shape of a fish. Fig. 20. Rock-paintings, Kei Islands. A similar backward industry was found in the Soki Cave, half-way between Ruteng and Reo. The most surprising find was that of a micro­ lith with battered-back of yellow-brown glass. It serves to prove th at palaeolithic foodgatherers occupied this cave till very recent time | Keywords: Cave""";;;;
drive-49cc5c3a1cf9;Ceruk Pajangan;Java;;;;;;No;Not documented;Not specified;;;Archaeological Sites;Rockshelter / Rock shelter / Ceruk;;;;No;;Description: alitatif memiliki potensi hunian. Pengharkatan kuantitatif terhadap kelima objek amatan menunjukkan potensi hunian tinggi hingga sedang, dan tidak ad a objek yang masuk dalam kategori potensi arkeologis rendah. Kompleks Ceruk Pajangan dengan empat ceruk yang lokasinya berdekatan, secara kuantitatif memiliki bobot potensi arkeologis tertinggi. Lokasi Kompleks Ceruk Pajangan yang mudah dijangkau serta mem iliki ruangan luas menghasilkan harkat potensi 34 Berkala Arkeologi Vol. 42 No. 1 Mei 2022 transformasi data. Kompleks Ceruk Pajangan sangat perlu unt uk dilestarikan karena memiliki nilai penting pengetahuan budaya prasejarah tidak hanya bagi Kabupaten Rembang dan Pati dan kawasan karst Zona Rembang, namun juga untuk wilayah Jawa secara keseluruhan. | Keywords: Karst;;;;
drive-b0796f213038;Goa Jepang;Java;;;;;;No;Not documented;Not specified;;;Archaeological Sites;Cave / Gua / Liang / Ceruk;;;;No;https://doi.org/10.1016/j.quaint.2020.03.054 | https://doi.org/10.1371/journal.pone.0193025 | https://doi.org/10.1016/j.quaint.2020.12.045 | https://doi.org/10.1016/j.quaint.2020.12.045;Description: 137Nilai Penting Sumberdaya Arkeologi Situs Patiayam Melacak Jejak Kehidupan Purba di Patiayam tersebut memiliki nilai penting akademik dan nilai penting sejarah peninggalan masa kolonial di Jawa. Antara Goa Jepang sebagai warisan budaya kolonial abad ke-20 dengan Situs Patiayam warisan budaya Kala Plestosen memang berada pada posisi kronologi terlampau jauh, namun untuk dimanfaatkan kepentingan pariwisata dapat dikemas bersama de ya tarik karena sebagian besar situs merupakan kawasan hutan produksi yang hanya dapat dilalui dengan jalan kaki. Di dalam perjalanan jelajah alam dan sejarah, wisatawan dapat menjadikan objek peninggalan sejarah berupa Goa Jepang sebagai tujuan akhirnya (Gambar V.5.). Menurut keterangan masyarakat setempat, peninggalan sejarah berupa Goa Jepang konon dahulu pernah ditemukan ada beberapa buah goa, namun karena terjadi longsoran tanah dari bukit d;;;;
drive-a7035fd366cf;Goa Tabuhan;Java;;;;;;No;Not documented;Not specified;-2580000;-11700;Archaeological Sites;Cave / Gua / Liang / Ceruk;;;;No;https://doi.org/10.1016/j.quaint.2020.03.054 | https://doi.org/10.1371/journal.pone.0193025 | https://doi.org/10.1016/j.quaint.2020.12.045 | https://doi.org/10.1016/j.quaint.2020.12.045;Description: ournal of Asian Earth Sciences. Hameau, Sebastien. 2004. Datation des sites paléolithiques du Pléistocène moyen et supérieur de Punung (Pacitan, Java) . Applications des méthodes ESR et U-Th aux grottes de Song Terus et Goa Tabuhan. (diss. MNHN) Handoko H., Lum J.K., Gustiani R., Kartapradja H., Sofro ASM., Marzuki S. 2001. Length variations in the COII-tRNAlys intergenic region of mitochondrial DNAin Indonesian populations . Hum Biol 73: 205- 233 niversity Dental Society 17(3):197–207. Hameau, S. 2004. “Datation Des Sites Paleolithiques Du Pleistocene Moyen et Superieur de Punung (Pacitan, Java). Applications Des Methodes ESR et U-Th Aux Grottes de Song Terus et Goa Tabuhan.” Paris: Museum National d’Histoire Naturelle 20. Hamilton, Warren Bell. 1979. Tectonics of the Indonesian Region. US Govt. Print. Off. Hammer, Ø., D. A. T. Harper, and P. D. Ryan. 2017. “PAST: Paleontological Statis | Keywords: Cave;;;;
drive-2a09c93a1019;Gua Alo-1;Java;;;;;;No;Not documented;Not specified;-2580000;1950;Archaeological Sites;Cave / Gua / Liang / Ceruk;;;;No;https://doi.org/10.30883/jba.v40i2.518 | https://doi.org/10.30883/jba.v30i1.385 | https://doi.org/10.30883/jba.v41i2.855 | https://doi.org/10.24164/pnk.v2i1.21;Description: (for explanation of characters see Table 21). 1 2 3 4 5 6 7 8 9 INDONESIA Gua Kepah B347 - - - - Gua Kepah C77 Wajak-1 - - - - - Wajak-2 - - Hoekgrot - - - - Sampung-H - ± - Liang Toge - - - - Liang Momer E - - - - - - Gua Alo-1 - Aimere - - JAVA: Middle Pleistocene Solo-1 + ± + + ± + Solo-3 ± + Solo-4 + ± Solo-5 + ± + + + + ± Solo-6 + + + + + + + + Solo-9 + ± + + ± Solo-10 + ± + + ± Solo-11 + + + + + + + + + CHINA Liujiang - - - - - - Upper Ca 3 Java Holocene Wajak-1,-2 O NNM 2 Hoekgrot O NNM 1 Gua Kecil O G. Kecil NNM 1 Gua Jimbe O G. Jimbe NNM 1 Sampung-H O Sampung NNM 1 Malásia Holocene Gua KepahB347,C77 O G.K.B347,-C77 NNM 2 Flores Holocene Aimere O NNM 1 Gua Alo-1,-2 O Alo.1,-2 NNM 2 Liang Momer-E O L.M.E NNM 1 Liang Toge O L.T. NNM 1 CHINA Liujiang R Liuj. NHM 1 Upper Cave-1,-2,-3 R 11.0,-2,-3 NHM 3 AUSTRALIA Kanalda O NHM 1 Keilor R NHM 1 Kow Swamp-1,-5,-15 R K.S.1,-5,-15 NHM 3 | Keywords: Cave;;;;
drive-5acc5ee05e10;Gua Braholo;Java;;4326;110.7489;-8.0692;;No;Not documented;Not specified;-2580000;1950;Archaeological Sites;Cave / Gua / Liang / Ceruk;;;;No;https://doi.org/10.30883/jba.v40i2.518 | https://doi.org/10.30883/jba.v30i1.385 | https://doi.org/10.30883/jba.v41i2.855 | https://doi.org/10.24164/pnk.v2i1.21;"""Description: Sangiran 22b of Javan Homo erectus x Sp H4 and Sp 17 of Zhoukoudian Homo erectus The mixed group of Early and Late Holocene Homo sapiens (green box) consists of: x Early Holocene Homo sapiens from Sukajadi, Gua Harimau, Gua Braholo, Song Keplek, and Gua Kidang x Late Holocene Homo sapiens from Gua Harimau and Song Keplek x Sp B.1 and Sp G.1 of Zhoukoudian Homo erectus Simanjuntak and Asikin, 2004 ). The chest region was covered with ochre, with a cobble and a mortar found near their lower limbs ( Marliac and Siman - juntak, 1996"; D ´etroit, 2002 ; Simanjuntak and Asikin, 2004 ). At Gua Braholo (Java, Indonesia), up to eight burials have been documented, showing diverse and unusual burial practices, including disarticulation, deliberate bone breakage, supine position of the upper body and flexed positions ( D | Keywords: Burial site;;
drive-a3b434479750;Gua Chauvet;Java;;;;;;No;Not documented;Not specified;;;Archaeological Sites;Cave / Gua / Liang / Ceruk;;;;No;https://doi.org/10.30883/jba.v40i2.518 | https://doi.org/10.30883/jba.v30i1.385 | https://doi.org/10.30883/jba.v41i2.855 | https://doi.org/10.24164/pnk.v2i1.21;Description: gua zaman prasejarah dan Paleolitikum (Batu Tua). Ia juga pernah menjadi curator Departemen Warisan Budaya dimana ia sekaligu penasihat akademik pada seni prasejarah. Clottes juga bertanggung jawab atas studi penelitian Gua Chauvet dan Cosquer. Selain itu, ia diakui sebagai ahli internasional dari ICOMOS dan UNESCO serta pengarang sejumlah buku tentang seni batuan di dunia. an nya, suatu hal yang se la lu kita ha rap kan. Jean C LOTTES ahli pra se ja rah, Kon ser va tor Eme ri tus Wa ri san Bu da ya Pra ka ta dari Jean Clottes 1 - Lihat sebuah foto lukisan gua di halaman 163. Jean Clottes, Gua Chauvet. 20;;;;
drive-d077ebcc8d55;Gua Dayak;Java;;;;;;No;Not documented;Not specified;-4000;-350;Archaeological Sites;Cave / Gua / Liang / Ceruk;;;;No;https://doi.org/10.30883/jba.v40i2.518 | https://doi.org/10.30883/jba.v30i1.385 | https://doi.org/10.30883/jba.v41i2.855 | https://doi.org/10.24164/pnk.v2i1.21;"""Description: The recent rock drawings of the Lenggong Valley, Perak, Malaysia Figure 8. T wo human ﬁgures from Gua Dayak: one has a kris around the waist and a sword in one hand; the other is holding a riﬂe in one hand while the other hand rests on the hip. for a wide range of Palaeolitic and Neolithic sites, such as Bukit Jawa that has s ngle. There are 72 limestone gua (caves/shelters) in the now light- to medium-forested Lenggong area. All 72 have been documented but only 5 have rock art, consisting of about 400 surviving charcoal drawings: Gua Badak, Gua Dayak, Gua Gelok, Gua Batu Puteh and Gua Batu T ukang (Figure 1). Evans (1918) states there were drawings in a sixth cave, Gua Kajang, but they have not survived. All of the rock art sites are located low in the landscape, cl | Keywords: Rock art site""";;;;
drive-45346b396be8;Gua Harimau Dan Perjalanan Panjang Peradaban;Java;;;;;;No;Not documented;Not specified;;;Archaeological Sites;Cave / Gua / Liang / Ceruk;;;;No;https://doi.org/10.24832/kpt.v26i1.229;Description: . Gunung Sewu in Prehistoric Times. Gadjah Mada University Press. ———. 2004. “New Insight on the Prehistoric Chronology of Gunung Sewu, Java, Indonesia.” Modern Quaternary Research in Southeast Asia 18:9–30. ———. 2015a. Gua Harimau Dan Perjalanan Panjang Peradaban OKU. Gadjah Mada University Press. ———. 2015b. “Progres Penelitian Austronesia Di Nusantara.” Amerta 33(1):25–44. ———. 2016. Harimau Cave and the Long Journey of OKU Civilization. edited by T. Simanjuntak. Yogyakarta: Gadja ara. In: Jejak Austronesia Di Indonesia. UGM Press, Yogyakarta, pp. 96–120. Oktaviana, A.A., Setiawan, P., Saptomo, E.W., 2015. Pola Seni Cadas (Rock Art) di Situs Gua Harimau Sumatra Selatan. In: Simanjuntak, T. (Ed.), Gua Harimau Dan Perjalanan Panjang Peradaban OKU. UGM Press, Yogyakarta, pp. 149–157. Oktaviana, A.A., Bulbeck, D., O'Connor, S., Hakim, B., Suryatman, Wibowo, U.P., St Pierre, E., Fakhri, 20 | Keywords: Cave;;;;
drive-fdf16e32cee2;Gua Kawasan Timur Jawa;Java;;;;;;No;Not documented;Not specified;;;Archaeological Sites;Settlement / Habitation / Permukiman / Kampung;;;;No;https://doi.org/10.30883/jba.v1i1.273 | https://doi.org/10.30883/jba.v21i1.830;"""Description: ches; Irian Jaya Studies; A Programme for Interdisciplinary Research. Rotterdam/Brookfield: Balkema. Hlm. 135-156. Muller, Kal. 2008. Mengenal Papua. Daisy World Books. Nurani, Indah Asikin. 2008. “Pola-pola Pemanfaatan Gua Kawasan Timur Jawa” dalam aros, Sulawesi Selatan”. Jurnal Walennae, Vol. 15, No. 1, Juni, 2017, Balai Arkeologi Sulawesi Selatan, Makassar. Nurani, Indah Asikin. 1995. “Pola Permukiman Gua -gua di Kaki Gunung Watangan: Suatu Hipotesis Permukiman Gua Kawasan Timur Jawa”, dalam Manusia dalam Ruang: Studi Kawasan dalam Arkeologi . Berkala Arkeologi Tahun XV -Edisi Khusus . Yogyakarta: Balai Arkeologi Yogyakarta, hal. 78—88. Setiawan, Taufiqurrahman, 2014 . “Analisis Stratigrafikronologi | Keywords: Karst""";;;;
