SITE_SOURCE_ID;SITE_NAME;LOCALISATION;GEONAME_ID;PROJECTION_SYSTEM;LONGITUDE;LATITUDE;ALTITUDE;CITY_CENTROID;STATE_OF_KNOWLEDGE;OCCUPATION;STARTING_PERIOD;ENDING_PERIOD;MAIN_CHARAC;CHARAC_LVL1;CHARAC_LVL2;CHARAC_LVL3;CHARAC_LVL4;CHARAC_EXP;BIBLIOGRAPHY;COMMENTS;WEB_IMAGES;DUPLICATE_DB_NAME;DUPLICATE_SCORE;DUPLICATE_FLAG
drive-8565fa629ab1;Liang Bangkai 1;;;;;;;No;Not documented;Not specified;;;Archaeological Sites;Rockshelter / Rock shelter / Ceruk;;;;No;Fajari, N., & Wibisono, W. (2020). Batu Cave: Prehistoric occupation of Meratus Mountains, South Kalimantan. Berkala Arkeologi, 40, 179-194. https://doi.org/10.30883/jba.v40i2.518; Description: Ceruk Bangkai 3 is a rockshelter site in the Meratus karst (Mantewe, Tanah Bumbu, South Kalimantan). Archaeological surveys in the area report occupation evidence such as faunal remains, freshwater shell, stone/bone artifacts, and hearth traces.;;;;
drive-480fb2665f44;Ceruk Ida Malangi;;;;;;;No;Not documented;Not specified;;;Archaeological Sites;Rockshelter / Rock shelter / Ceruk;;;;No;https://doi.org/10.24273/jgeet.2017.2.2.300 | https://doi.org/10.5539/apr.v4n1p178;Description: ented by Indonesia’s National Research Centre for Archaeology in 1977, with further studies in 1984 and 1986 (Kosasih 1985, 1989, 1995). The 10 sites of Gua Metanduno, Gua Kabori, Gua Wa Bose, Gua T oko, Gua La Kolumbu, Ceruk Ida Malangi, Ceruk Lasabo A, Ceruk Lasabo B, Ceruk La Nsafora and Ceruk Tangga Ara were recorded for a variety of motifs including anthropomorphs, zoomorphs, sun and boat motifs, and warfare and hunting weapons that were possibly m the National Research Centre of Archaeology and Pindi Setiawan from the Bandung Institute of T echnology. These observations documented the parietal art of various caves and caverns, including Gua Metanduno, Gua Kabori, Ceruk Ida Malangi, Gua Sugi Patani, Ceruk La Podo, Gua Pominsa and Ceruk Lakan Taghu (Figure 6.2). A review of the literature was done to contextualise these observations with those from earlier texts relating to the prehi | Keywords: Cave;;;;
drive-b0be0318a9f2;Ceruk Lasabo A;;;;;;;No;Not documented;Not specified;;;Archaeological Sites;Rockshelter / Rock shelter / Ceruk;;;;No;;Description: s National Research Centre for Archaeology in 1977, with further studies in 1984 and 1986 (Kosasih 1985, 1989, 1995). The 10 sites of Gua Metanduno, Gua Kabori, Gua Wa Bose, Gua T oko, Gua La Kolumbu, Ceruk Ida Malangi, Ceruk Lasabo A, Ceruk Lasabo B, Ceruk La Nsafora and Ceruk Tangga Ara were recorded for a variety of motifs including anthropomorphs, zoomorphs, sun and boat motifs, and warfare and hunting weapons that were possibly made from metal. ali diteliti tahun 1977 oleh Pusat Penelitian Purbakala dan Peninggalan Nasional . Lukisan gua terpenting di kawasan ini ditemukan di Gua Metanduno, Gua Kabori, Gua Wa Bose, Gua Toko, Gua La Kolumba, Ceruk Ida Ma langi, Ceruk Lasabo A, Ceruk Lasabo B, Ceruk La Nsarofa, dan Ceruk Tangga Ara. Lukisan gua umumnya menggunakan warna merah atau coklat dengan objek gambar yang beragam, seperti gambar manusia, binatang, matahari, perahu, geometris, d;;;;
drive-f1c0a7c0c667;Ceruk Lasabo B;;;;;;;No;Not documented;Not specified;;;Archaeological Sites;Rockshelter / Rock shelter / Ceruk;;;;No;;Description: rch Centre for Archaeology in 1977, with further studies in 1984 and 1986 (Kosasih 1985, 1989, 1995). The 10 sites of Gua Metanduno, Gua Kabori, Gua Wa Bose, Gua T oko, Gua La Kolumbu, Ceruk Ida Malangi, Ceruk Lasabo A, Ceruk Lasabo B, Ceruk La Nsafora and Ceruk Tangga Ara were recorded for a variety of motifs including anthropomorphs, zoomorphs, sun and boat motifs, and warfare and hunting weapons that were possibly made from metal. These motifs wer un 1977 oleh Pusat Penelitian Purbakala dan Peninggalan Nasional . Lukisan gua terpenting di kawasan ini ditemukan di Gua Metanduno, Gua Kabori, Gua Wa Bose, Gua Toko, Gua La Kolumba, Ceruk Ida Ma langi, Ceruk Lasabo A, Ceruk Lasabo B, Ceruk La Nsarofa, dan Ceruk Tangga Ara. Lukisan gua umumnya menggunakan warna merah atau coklat dengan objek gambar yang beragam, seperti gambar manusia, binatang, matahari, perahu, geometris, dan abstrak. Mot;;;;
drive-39516096f6df;Ceruk Poko;;;;;;;No;Not documented;Not specified;;;Archaeological Sites;Rockshelter / Rock shelter / Ceruk;;;;No;;Description: mat Dwi Putra) Tabel 14. Sintesis pengharkatan kandungan data arkeologis. Nama Gua Jumlah temuan Jenis temuan Variabilitas Harkat Kelas Gua Keongan 14 Tulang fauna dan kerang bivalve (beberapa adalah scraper) 2 2 sedang Ceruk Poko 11 Tulang fauna dan gerabah 2 2 sedang Gua Watu Gong 18 Tulang fauna dan kerang 2 2 sedang Gua Gogor 6 Kerang 1 1 sedikit Kompleks Ceruk Pajangan 41 Alat batu, kerang, tulang fauna, rangka manusia 4 3 banyak Sumber: Wib rea dengan topografi relatif rata. Tabel 10. Sintesis pengharkatan elevasi relative. Nama Gua Ketinggian Situs (mdpl) Dasar Lembah (mdpl) Elevasi Relatif Harkat Elevasi Relatif Kelas Gua Keongan 184 182 2 5 sangat kecil Ceruk Poko 165 157 8 5 sangat kecil Gua Watu Gong 202 157 45 3 sedang Gua Gogor 94 70 24 4 kecil Kompleks Ceruk Pajangan 195 170 25 4 kecil Sumber: Wibowo et al., 2021 Data Medan Kelas Lereng Tunggal Melalui pengharkatan lereng t;;;;
drive-4cc4c8c17a52;Ceruk Sirebi Seiwu Sebagai Tempat Penguburan;;;;;;;No;Not documented;Not specified;;;Archaeological Sites;Rockshelter / Rock shelter / Ceruk;;;;No;Kebudayaan Indonesia sangat beragam, terdiri dari berbagai suku, adat istiadat, agama, (2013);Description: askan jenis-jenis pemasyarakatan hasil penelitian yang dilakukan oleh Balai Arkeologi Jayapura. Sonya M. Kawer membahas c eruk penguburan yang terdapat di Kampung Kamarisano dan fungsi ceruk dalam artikelnya Pemanfaatan Ceruk Sirebi Seiwu Sebagai Tempat Penguburan di Kampung Kamarisano Distrik Wapoga Kabupaten Waropen. Peneliti Balai Pelestarian Sejarah dan Nilai Tradisional Jayapura. Windy Hapsari menulis Fungsi Manibob dalam Kehidupan Orang Biak, dalam artikelnya Windy membahas buran Masa Lalu pada Masyarakat Supiori di Kabupaten Supiori ................... 97 Hari Suroto Pemasyarakatan Hasil-Hasil Penelitian Balai Arkeologi Jayapura ............................. 111 Sonya M. Kawer Pemanfaatan Ceruk Sirebi Seiwu Sebagai Tempat Penguburan di Kampung Kamarisano Distrik Wapoga Kabupaten Waropen ...................................................... 121 Windy Hapsari Fungsi Manibob dalam K;;;;
drive-7e160cbafae6;Gua Baik;;;;;;;No;Not documented;Not specified;-11700;1950;Archaeological Sites;Shell midden / Shell mound / Bukit Kerang / Kjokkenmoddinger;;;;No;https://doi.org/10.30883/jba.v40i2.518 | https://doi.org/10.30883/jba.v30i1.385 | https://doi.org/10.30883/jba.v41i2.855 | https://doi.org/10.24164/pnk.v2i1.21;"""Description: ic samples. The Temiar range includes Gua Cha, which has provided the majority of our Hoabinhian and neo- lithic specimens, as well as Gua Peraling. On its western margin, the Temiar range includes or abuts Gua Harimau, Gua Baik, Gua Gunung Runtuh and Gua Kerbau, four other sites with many burials between them (Fig. 6.1). As would be consistent with a local continuity scenario, we have some evidence that a larger proportion of the genes of the specimens represent foragers but suspect the same for the Guar Kepah remains deposited in shell middens where waisted axes and pot sherds co-occur with Hoabinhian pebble tools. The extended supine burials at Gua Cha and Gua Baik, which reflect the Ban Kao mortuary tradition (otherwise found at neolithic sites in south a nd central Thailand; see Bellwood 1997) in terms of their age (c . 3,000 years BP), interment method and grave goods of cerami | Keywords: Shell midden""";;;;
drive-7e3a118d53fc;Gua Batu Tukang;;;;;;;No;Not documented;Not specified;;;Archaeological Sites;Cave / Gua / Liang / Ceruk;;;;No;https://doi.org/10.30883/jba.v40i2.518 | https://doi.org/10.30883/jba.v30i1.385 | https://doi.org/10.30883/jba.v41i2.855 | https://doi.org/10.24164/pnk.v2i1.21;Description: 4.000 hingga 8.000 tahun lalu (Chia dan Zuraina , dalam Saidin dan Taςon, 2011). Sementara itu, lukisan gua di Gua Niah (Serawak) berasal dari masa 1.000 hingga 2.000 tahun lalu, Gua Dayak sekitar 1.500 tahun lalu, dan Gua Batu Tukang berasal dari 4.000 tahun lalu (Chia , dalam Saidin dan Taςon, 2011). Seandainya kronologi lukisan gua tersebut di atas benar, maka konsekuensinya terdapat perbedaan dalam manusia pendukung kebudayaannya. Kurun waktu kir erutama ditemukan di wilayah Perak, Kedah, Pahang, dan Kelantan (Hamid, 2014, Sai din dan Taςon, 2010). Lukisan gua di wilayah Perak sebagian besar berada di Lembah Lenggong terdiri atas Gua Badak, Gua Dayak, Gua Gelok, Gua Batu Tukang, dan Gua Batu Puteh. Objek gambar yang ditemukan di wilayah Perak ini dibuat dengan arang warna hita m dengan motif manusia, binatang, cap tangan, geometris, dan kendaraan seperti mobil, sepeda motor, dan sepe;;;;
drive-00bd1de3cb8a;Gua Ber;;;;;;;No;Not documented;Not specified;;;Archaeological Sites;Burial / Cemetery / Kubur / Makam;;;;No;https://doi.org/10.30883/jba.v40i2.518 | https://doi.org/10.30883/jba.v30i1.385;Description: tan Timur. Pe ne mu an di Gua Mar dua, garca per ta ma di Ka li man tan. Pen je la jah an Su - ngai Bai. Pe ser ta: Je an-Mi chel Cha zi ne, Luc-Hen - ri Fage. 1995 Agus tus-Sep tem ber: pe ne mu an garca di Gua Payau, Gua Ber ha da pan, Gua Kam bing, dan Liang Sara. Pe ser ta: Je an-Mi chel Cha zi ne, Luc-Hen ri Fage, Pindi Se tia wan, Ta ngu y Thu a ud (ka me ra). Pem bu at an film À la dé cou ver te des grot tes or - nées de Bor néo, (Fran an. Bukan makam yang kami mi na ti, me la in kan pe ning ga lan ar ke o lo - gis lebih kuno yang mung kin ter da pat di bawah peti mati. Namun, tidak mung kin me nga is-nga is di sini, apa la gi di tem pat ini ka re na Liang Ber aneh masih di gu na kan se ba gai pe ma ka man orang Aho eng dari lem bah se la ma be be ra pa da sa war sa ini… Kami lalu me man jat, ter ka dang pada jalur parit yang rumit, ter ka dang me la lui te bing me na ra-kars;;;;
drive-1553952cbed2;Gua Berak;;;;;;;No;Not documented;Not specified;;;Archaeological Sites;Cave / Gua / Liang / Ceruk;;;;No;https://doi.org/10.30883/jba.v40i2.518 | https://doi.org/10.30883/jba.v30i1.385 | https://doi.org/10.30883/jba.v41i2.855 | https://doi.org/10.24164/pnk.v2i1.21;"""Description: an; 7. Ara Raya; 8. Gua Masri; 9. Gua Ilas Kenceng; 10. Gua Tewet, Gua Pindi, Gua Te'et, Gua Ujan, Gua Batu Aji; 11. Gua Tamrin, Gua Mentis, Gua Kayu Sampung, Gua lias Kecil, Gua Tangkorak, Gua Kurang Tahu, Gua Ham; 13. Gua Berak, GuaJufri, Gua Tembus, Gua Sahak; 14. Gua Lungun, Gua Keboboh, Gua Gudang Pecah, Gua Ampir Kosong, Liang Jon. The inset is shown as Figure 2. these sites consist only of lithic scatters that have not yielded organic rem tu yang tum buh, yang hanya dapat di je las kan oleh kuku yang sa ngat pan jang. Kami akan mem ba has nya lebih lan jut. Misi 2002, yang se mu la hanya murni spe leo lo - gis, di mu lai de ngan te mu an di le reng barat Gua Berak (54 ta ngan) dan Gua Payau II (38 ta ngan dan gam bar geo met ris yang me nim bul kan per ta nya an). Lu kis an itu mem be ri kon tri bu si yang mem per ka ya pe nge ta hu an kami ten tang garca yang be gi tu ter - sem""";;;;
drive-258250d0f75a;Gua Braholo BHL F7;;;;;;;No;Not documented;Not specified;;;Archaeological Sites;Cave / Gua / Liang / Ceruk;;;;No;https://doi.org/10.30883/jba.v40i2.518 | https://doi.org/10.30883/jba.v30i1.385 | https://doi.org/10.30883/jba.v41i2.855 | https://doi.org/10.24164/pnk.v2i1.21;Description: WN 3 4 0 0 0 0 0 ? 0 2 ? 0 0 0 0 45 Pawon PWN 4 4 0 0 0 ? 0 0 0 3 0 ? 0 ? 0 46 Pawon PWN 5 5 2 0 0 0 0 0 ? 3 1 1 0 ? ? 47 Gua Braholo BHL 1 4 0 0 0 0 0 0 0 2 1 1 0 1 0 48 Gua Braholo BHL 5 4 0 0 0 0 0 0 0 3 3 0 0 1 0 49 Gua Braholo BHL F7 4 0 0 0 0 0 0 0 2 1 0 0 1 0 50 Gua Braholo BHL97-F4-17 4 0 0 0 1 0 0 0 3 1 0 0 1 0 429 39 Pawon PWN 5 12,5 12,4 40 Gua Braholo BHL 1 11 10,8 41 Gua Braholo BHL 5 12,1 11,8 42 Gua Braholo BHL F7 11,4 11,2 43 Song Tritis STR 1 10,3 10,5 44 Song Terus ST 1 11,2 11,8 45 Song Terus ST94-KI-95-100 13 11,6 46 Song Keplek SK 4 11,8 12,2 47 Gua Kidang GKD 2 9,2 10,5 48 Goea Djimbe DMB 17324 12 12 49 Goea Djimbe DMB 173;;;;
drive-54ab87e7293a;Gua Braholo BHL H8;;;;;;;No;Not documented;Not specified;-11700;1950;Archaeological Sites;Cave / Gua / Liang / Ceruk;;;;No;https://doi.org/10.30883/jba.v40i2.518 | https://doi.org/10.30883/jba.v30i1.385 | https://doi.org/10.30883/jba.v41i2.855 | https://doi.org/10.24164/pnk.v2i1.21;Description: 385 b. Holocene Homo sapiens Gua Braholo NO LOCALITY NO. COL CATEGORY GRADE 1 Gua Braholo BHL 97-F4-12 URC 2 2 Gua Braholo BHL 97-F4-20 URC 3 3 Gua Braholo BHL H8 410 URM2 5 4 Gua Braholo BHL H8 412 URM3 2 Table A.30. Wear pattern of isolated upper teeth from Gua Braholo The observation shows 3 of 4 isolated upper teeth from Gua Braholo site could be included in the further analy 389 b. Holocene Homo sapiens Gua Braholo NO LOCALITY NO. COL CATEGORY GRADE 1 Gua Braholo BHL 97-F4-17 LRM2 3 2 Gua Braholo BHL 98-I7-19 LRP4 1 3 Gua Braholo BHL H8 411 LRM3 3 Table A.38. Wear pattern of isolated lower teeth from Gua Braholo. The observation shows all of 3 isolated lower teeth from the Gua Harimau site could be included in the further analysis (Table A.38). Song Te;;;;
drive-2e0e09d75155;Gua Debu;;;;;;;No;Not documented;Not specified;-4000;-350;Archaeological Sites;Cave / Gua / Liang / Ceruk;;;;No;https://doi.org/10.30883/jba.v40i2.518 | https://doi.org/10.30883/jba.v30i1.385 | https://doi.org/10.30883/jba.v41i2.855 | https://doi.org/10.24164/pnk.v2i1.21;"""Description: TABLE 12 Site Total Uni face Bi face reported Gua Kajang 5 1 ? Gua 'To 'Long 6 - 6 Kota Tongkat 2 ? 1 Gua Kerbau ? some some Gua Debu 32 ? some Gel Ba'i t ? some some Bukit Chintamani ? ? ? Bukit Chu ping 6 6 - Gua Madu 500 ? some Gua Cha - - some 'rABLE 12. Flaked pebble tools from Malayan sites. pt Gunong Cheroh. Unio seems also to have been frequently found. This common element of diet is consistent with a food gathering economy. At some sites Melania shell was particularly abundant; Collings 1 reports that at Gua Debu 548 Melaniid shells were counted in an area six feet by eight feet and six inches deep. Collings identifies marine and freshwater molluscs from Bukit Chuping, 2 which are listed in Table 11. Bukit Chuping is now eleven | Keywords: Karst""";;;;
drive-51ae3ac1c87f;Gua Gogor;;;;;;;No;Not documented;Not specified;;;Archaeological Sites;Rockshelter / Rock shelter / Ceruk;;;;No;https://doi.org/10.30883/jba.v40i2.518 | https://doi.org/10.30883/jba.v30i1.385 | https://doi.org/10.30883/jba.v41i2.855 | https://doi.org/10.24164/pnk.v2i1.21;Description: temuan Variabilitas Harkat Kelas Gua Keongan 14 Tulang fauna dan kerang bivalve (beberapa adalah scraper) 2 2 sedang Ceruk Poko 11 Tulang fauna dan gerabah 2 2 sedang Gua Watu Gong 18 Tulang fauna dan kerang 2 2 sedang Gua Gogor 6 Kerang 1 1 sedikit Kompleks Ceruk Pajangan 41 Alat batu, kerang, tulang fauna, rangka manusia 4 3 banyak Sumber: Wibowo et al., 2021 Potensi Arkeologis Gua di Zona Rembang Bagian Barat Mayoritas situs di Zona Rembang vasi relative. Nama Gua Ketinggian Situs (mdpl) Dasar Lembah (mdpl) Elevasi Relatif Harkat Elevasi Relatif Kelas Gua Keongan 184 182 2 5 sangat kecil Ceruk Poko 165 157 8 5 sangat kecil Gua Watu Gong 202 157 45 3 sedang Gua Gogor 94 70 24 4 kecil Kompleks Ceruk Pajangan 195 170 25 4 kecil Sumber: Wibowo et al., 2021 Data Medan Kelas Lereng Tunggal Melalui pengharkatan lereng tunggal diketahui bahwa mayoritas situs berada di dalam kelas lereng te;;;;
drive-7e340ccbac1f;Gua Keongan;;;;;;;No;Not documented;Not specified;;;Archaeological Sites;Rockshelter / Rock shelter / Ceruk;;;;No;https://doi.org/10.30883/jba.v40i2.518 | https://doi.org/10.30883/jba.v30i1.385 | https://doi.org/10.30883/jba.v41i2.855 | https://doi.org/10.24164/pnk.v2i1.21;Description: g bagian barat (Hari Wibowo, Ahmad Surya Ramadhan, Muhammad Wisnu Wibisono, dan Rakhmat Dwi Putra) Tabel 14. Sintesis pengharkatan kandungan data arkeologis. Nama Gua Jumlah temuan Jenis temuan Variabilitas Harkat Kelas Gua Keongan 14 Tulang fauna dan kerang bivalve (beberapa adalah scraper) 2 2 sedang Ceruk Poko 11 Tulang fauna dan gerabah 2 2 sedang Gua Watu Gong 18 Tulang fauna dan kerang 2 2 sedang Gua Gogor 6 Kerang 1 1 sedikit Kompleks Ceruk dan tidak ada yang termasuk dalam kategori aksesibilitas sulit atau sangat sulit. Tabel 12. Sintesis pengharkatan aksesibilitas. Nama Gua Harkat Elevasi Relatif Harkat Lereng Tunggal Interval Harkat Aksesibilitas Kelas Gua Keongan 5 4 9 5 sangat mudah Ceruk Poko 5 3 8 4 mudah Gua Watu Gong 3 3 6 3 sedang Gua Gogor 4 5 9 5 sangat mudah Kompleks Ceruk Pajangan 4 3 7 4 mudah Sumber: Wibowo et al., 2021 Variabel Morfologi Gua Kriteria morfologi yan;;;;
drive-a34552383712;Gua Kuya. Konsentrasi;;;;;;;No;Not documented;Not specified;;;Archaeological Sites;Cave / Gua / Liang / Ceruk;;;;No;https://doi.org/10.30883/jba.v40i2.518 | https://doi.org/10.30883/jba.v30i1.385 | https://doi.org/10.30883/jba.v41i2.855 | https://doi.org/10.24164/pnk.v2i1.21;Description: d/index.php/sangia ISSN 2654-3524 (Online) ISSN 2613-8999 (Print) 47 3.2.3 Fragmen Keramik Gambar 2.3 Fragmen Keramik II pada Situs Gua Kuya (Dok: Ato, 2021) Gambar 2.3 di atas, merupakan fragmen keramik di lereng situs Gua Kuya. Konsentrasi fragmen keramik terletak pada grid S6B3 terdapat di permukaan tanah lereng Gua Kuya. Kondisi keramik tidak utuh. Pada bagian keramik terdapat tanah yang melekat. Bentuk keramik yang diasumsikan adalah mangkuk. Fragmen k SSN 2613-8999 (Print) 48 3.2.5 Fragmen Tengkorak dan Tulang Gambar 2.5 Fragmen Tengkorak dan Tulang pada Situs Gua Kuya (Dok: Ato, 2012) Gambar 2.5 di atas, merupakan fragmen tengkor ak dan tulang yang terdapat di Situs Gua Kuya. Konsentrasi fragmen terdapat pada grid U3T3 di atas permukaan lantai Gua Kuya. Kotak ini berada di dekat dinding gua dengan ketinggian 100 cm diatas permukaan tanah. Kondisi fragmen tengkorak pada saat ditemu;;;;
drive-801b70ba7128;Gua La Kolumbu;;;;;;;No;Not documented;Not specified;;;Archaeological Sites;Rockshelter / Rock shelter / Ceruk;;;;No;https://doi.org/10.30883/jba.v40i2.518 | https://doi.org/10.30883/jba.v30i1.385 | https://doi.org/10.30883/jba.v41i2.855 | https://doi.org/10.24164/pnk.v2i1.21;Description: was first documented by Indonesia’s National Research Centre for Archaeology in 1977, with further studies in 1984 and 1986 (Kosasih 1985, 1989, 1995). The 10 sites of Gua Metanduno, Gua Kabori, Gua Wa Bose, Gua T oko, Gua La Kolumbu, Ceruk Ida Malangi, Ceruk Lasabo A, Ceruk Lasabo B, Ceruk La Nsafora and Ceruk Tangga Ara were recorded for a variety of motifs including anthropomorphs, zoomorphs, sun and boat motifs, and warfare and hunting weapons t : Rock art sites in the study area. Source: Adapted from Oktaviana (2016). 1 See Marschall and Wäﬂer (2012) for site maps, photographs and sketches of the rock art from Gua Metanduno, Gua Kabori, Gua Wa Bose, Gua T oko, Gua La Kolumbu and Ceruk Lasabo. | Keywords: Rock art site;;;;
drive-94773a246912;Gua Leo;;;;;;;No;Not documented;Not specified;;;Archaeological Sites;Cave / Gua / Liang / Ceruk;;;;No;https://doi.org/10.30883/jba.v40i2.518 | https://doi.org/10.30883/jba.v30i1.385 | https://doi.org/10.1016/j.quaint.2009.1;Description: e ser ta: Pat - rick De gou ve, Chris ti an Lo ca tel li, Jo si a ne dan Ber - nard Lips, Geor ges Ro bert. 2003 Mei: eks pe di si pe ne li ti an di Gu nung Ma rang, se ba gi an di bia yai oleh SPB, pe ne mu an garca di Gua Leo, Liang Karim, Ilas Kerim. Pe ser ta: Serge Cail la ult, Luc-Hen ri Fage. Ok to ber-No vem ber: eks pe di si besar yang di - bia yai oleh Na tio nal Geo grap hic So ci e ty, de ngan syu ting film untuk ARTE, kun jung an ia. Se lain pe lin dung an yang lazim, se per ti pe ma sang an pagar dan pos pen ja ga, se ba ik nya wi la yah pe gu nung an karst di Ka li man tan Timur di ma suk kan dalam cagar q Gua Ham, matahari terbit di lembah… w Gua Leo yang rumit, terletak di tebing 150 m dari Sungai Bengalon, memperlihatkan berbagai bentuk erosi khas di cekungan yang tergenang, dengan rongga yang sangat luas. Pembentukan tipe cekungan seperti itu terjadi pada masa ge | Keywords: Karst;;;;
drive-c6a268b563e4;Gua Liang Batu Ukir;;;;;;;No;Not documented;Not specified;;;Archaeological Sites;Rockshelter / Rock shelter / Ceruk;;;;No;https://doi.org/10.30883/jba.v40i2.518 | https://doi.org/10.30883/jba.v30i1.385 | https://doi.org/10.1016/j.jhevol.2006.08.011;Description: c) Distribution of lithik tools at the Sites of Gua Liang Batu Ukir . Based on surface surveys in sector 3, Gua Liang Batu Ukirfound the distribution of lithik tools such a s flakes, flakes tools, point tools, and core stones [3]. The morphological features of flake tools are the same a food and ways to process food resources. Based on the analysis of morphological characteristics of Gua Liang Bangkai 1, Gua Liang Bangkai10, Gua Liang Batu Ukir, Ceruk Liang Susu 1 and Gua Liang Jago , it is known that the selection of residential caves is based on the intensity of sunlight into t he cave room. This factor has caused the cave room to be dry and not moist. In ad | Keywords: Cave;;;;
drive-c13b662fff1c;Gua Madu;;;;;;;No;Excavated;Not specified;-11700;1950;Archaeological Sites;Cave / Gua / Liang / Ceruk;;;;No;https://doi.org/10.30883/jba.v40i2.518 | https://doi.org/10.30883/jba.v30i1.385 | https://doi.org/10.30883/jba.v41i2.855 | https://doi.org/10.24164/pnk.v2i1.21;Description: 8 II 1927 Evans, 1928 I Gua Debu 1935 Collings, 1936 Gua Kelawar 1935 II 1936 Gol Ba1 it 1935 Callenfels and Noone, 1940 Bu.kit Chintamani 1935 Tweedie, 1936 Gua Cha 1935 Noone, 1939 Bu.lei t Chuping 1936 Collings, 1937 Gua Madu 1939 1I1weedie, 1940 Gua Cha 1954 Sieveking, 1954 TABLE 8. Sites excavated in Malaya. TABLE 12 Site Total Uni face Bi face reported Gua Kajang 5 1 ? Gua 'To 'Long 6 - 6 Kota Tongkat 2 ? 1 Gua Kerbau ? some some Gua Debu 32 ? some Gel Ba'i t ? some some Bukit Chintamani ? ? ? Bukit Chu ping 6 6 - Gua Madu 500 ? some Gua Cha - - some 'rABLE 12. Flaked pebble tools from Malayan sites. | Keywords: Excavated site;;;;
drive-e20181d2440f;Gua Masri I;;;;;;;No;Not documented;Not specified;;;Archaeological Sites;Cave / Gua / Liang / Ceruk;;;;No;https://doi.org/10.30883/jba.v40i2.518 | https://doi.org/10.30883/jba.v30i1.385 | https://doi.org/10.30883/jba.v41i2.855 | https://doi.org/10.24164/pnk.v2i1.21;Description: las air. Namun, kami tidak akan tahan be gi ni ter la lu lama. Ke esok an ha ri nya, kami kem ba li ke gua yang kami namai Gua Masri untuk meng hor mati pe man - du kami dan lang sung naik ke gua kedua. Ke ju tan besar! Gua Masri II itu ga le ri nya kecil dan me nu suk ke arah me na ra karst. Ga le ri mem ben tang 5 m de ngan ting gi 2 m, “me re ka” telah me nyem bur kan te ra an 71 ta ngan ma nu sia, de ngan su sun an yang meng he ran kan. Ada su tidak jelas Kelompok 4 27 tanganKelompok 2 9 tangan Kelompok 1 10 tangan di ketinggian 4.50 m Kelompok 3 13 tangan: 5 Ka - 6 Ki - 2 tidak jelas14 tangan 1 tanganDi kedalaman gua ( - dan penjelajahan) 1 tangan Batu bilah Gua Masri I Setelah mendaki 15 m dan berjalan di atas reruntuhan yang dilindungi oleh cadas-overhang, kami masuk ke gua ini melalui rongga relatif sempit yang membatasi terobosan cahaya. Segera kami dapati galeri melebar yang me | Keywords: Karst;;;;
drive-ae948b55aa35;Gua Mentanduno;;;;;;;No;Not documented;Not specified;;;Archaeological Sites;Rockshelter / Rock shelter / Ceruk;;;;No;https://doi.org/10.30883/jba.v40i2.518 | https://doi.org/10.30883/jba.v30i1.385 | https://doi.org/10.30883/jba.v41i2.855 | https://doi.org/10.24164/pnk.v2i1.21;Description: In 2005, the first observations of negative hand stencils on Muna Island were made at Gua Pominsa by the Makassar Archaeology Office. In 2015, more negative hand stencils were recorded at two further Muna Island sites (Gua Mentanduno and Gua Kabori) by the Directorate of Cultural Property Preservation and Museums, and in 2016 a new site with parietal art (Gua Lakan Taghu) was discovered. Analysis of the Muna Island boat imagery documents the depicti eded to confirm this claim, and the coralloid speleothems that cover one of the Gua Metanduno stencils may prove suitable for dating. Table 6.2: Recorded prau motifs in the Muna karsts. Site Number of prau motifs Source Gua Mentanduno 17 13 Kosasih 1995 BCPBM 2015 Gua Kabori 16 9 Kosasih 1995 BCPBM 2015 Gua Pominsa 14 BCPBM 2015 La Kolumba 2 Kosasih 1995 Lasobo A 2 Kosasih 1995 Lakuba 1 BCPBM 2015 Ceruk Lakan Taghu 2 Oktaviana 2016 Source: Ok | Keywords: Rock art site;;;;
drive-56170111538d;Gua Mentis;;;;;;;No;Not documented;Not specified;;;Archaeological Sites;Cave / Gua / Liang / Ceruk;;;;No;https://doi.org/10.30883/jba.v40i2.518 | https://doi.org/10.30883/jba.v30i1.385 | https://doi.org/10.30883/jba.v41i2.855 | https://doi.org/10.24164/pnk.v2i1.21;"""Description: . Gua Mardua; 2. Gua Payau; 3. Gua Kambing; 4. Liang Sara; 5. Alan Bilao; 6. Liang Pelahniran; 7. Ara Raya; 8. Gua Masri; 9. Gua Ilas Kenceng; 10. Gua Tewet, Gua Pindi, Gua Te'et, Gua Ujan, Gua Batu Aji; 11. Gua Tamrin, Gua Mentis, Gua Kayu Sampung, Gua lias Kecil, Gua Tangkorak, Gua Kurang Tahu, Gua Ham; 13. Gua Berak, GuaJufri, Gua Tembus, Gua Sahak; 14. Gua Lungun, Gua Keboboh, Gua Gudang Pecah, Gua Ampir Kosong, Liang Jon. The inset is shown ena ada sungai di luarnya, sehingga air memanfaatkan celah di batuan sebagai daya serap ketika banjir. Dengan demikian, cekungan itu berkontribusi dalam memperbesar tebing dan celah tektonik untuk membentuk gua besar. u Gua Mentis, dua yang bergambar 24 tangan negatif. Grafiti modern yang banyak itu menutupi lukisannya… alam yang luas se hing ga tidak hanya me les ta ri kan wa ri san pra se ja rah ber ta raf dunia, tapi juga wa ri san alam. Hutan""";;;;
