SITE_SOURCE_ID;SITE_NAME;LOCALISATION;GEONAME_ID;PROJECTION_SYSTEM;LONGITUDE;LATITUDE;ALTITUDE;CITY_CENTROID;STATE_OF_KNOWLEDGE;OCCUPATION;STARTING_PERIOD;ENDING_PERIOD;MAIN_CHARAC;CHARAC_LVL1;CHARAC_LVL2;CHARAC_LVL3;CHARAC_LVL4;CHARAC_EXP;BIBLIOGRAPHY;COMMENTS;WEB_IMAGES;DUPLICATE_DB_NAME;DUPLICATE_SCORE;DUPLICATE_FLAG
drive-f10c2955d363;Gua Macinai;Maluku Islands;;;;;;No;Excavated;Not specified;;;Archaeological Sites;Cave / Gua / Liang / Ceruk;;;;No;https://doi.org/10.30883/jba.v40i2.518 | https://doi.org/10.30883/jba.v30i1.385 | https://doi.org/10.30883/jba.v41i2.855 | https://doi.org/10.24164/pnk.v2i1.21;"""Description: g Saripa, Leang Jarie); PTB: Panganreang Tudea, Batu Ejaya, Leang Batu Tuda, Campagaloe; LMN: Lamoncong (Leang Cakondo, Leang Balisao, Leang Ululeba, Leang Tomatoa Kacicang); PKJ: Pangkajene (Sumpang Bita, Gua Bulusumi, Gua Macinai, Gua Garunggung); KLP: Kalumpang (Minanga Sipakko, Kamassi); NUH: Nuha, Sukoyu, Pontanoa Bangka; BLA: Belae karsts (including Gua Sakapao); GLS: Galesong (including Pakka Mukang). Individual shelters: peninsula: LC: Lea 972: 111) unreported excavation at Leang Panameanga in 1937, Sumantri's (1986) quite detailed description of the finds from Gua Garunggung, and Subagus's (1986) brief account of the stone artefacts from Gua Bulusumi and Gua Macinai (see Fig. 1). Even though it is far from clear that any of the excavators could recognise backing at the time when they observed their artefacts, on present evidence the distribution of backed microliths should be re | Keywords: Excavated site""";;Gua Maccina;0.91;near-match
drive-1f2cef90b80f;Gua Mar;Maluku Islands;;;;;;No;Not documented;Not specified;;;Archaeological Sites;Cave / Gua / Liang / Ceruk;;;;No;https://doi.org/10.30883/jba.v40i2.518 | https://doi.org/10.30883/jba.v30i1.385 | https://doi.org/10.3406/arch.1976.1271;Description: di jelas dalam se per se ki an detik, wa lau pun aku tak per nah ber ha rap, toh im pi an masa ke cil ku ter wu jud jua. Tang gal 20 agus tus 1994, hari per ta ma misi baru kami, dan kami baru me ma su ki gua per ta ma, Gua Mar dua, 2 km dari Desa Pe nga dan, di pe si sir ti mur Ka - li man tan. Aku baru saja men je la jahi ba gi an ge lap nya yang ti dak ada apa-apa nya, dan aku du duk di ba wah mua ra gua sam bil meng isap kre tek di te ma n ma nu sia telah me nye berang dan mulai men du duki Aus tra lia se ki tar 50.000 tahun lalu. Te mu an kami pas ti lah meng ge ger kan ko mu ni tas ar ke o lo gi Asia Teng ga ra. Kami me ni lik kem ba li ber ka li-ka li Gua Mar dua ini. Mata ke mu di an ter bia sa, te ra ma ti oleh kami lebih ba nyak gambar yang dulu tak ter li hat, juga dapat meng ama ti lebih luas dae rah ber gam bar yang ter si sa sam pai saat ini. Ter uta ma dae rah yang t | Keywords: Karst;;;;
drive-83441c0ed9c2;Gua Pawon. Sumber;Maluku Islands;;;;;;No;Not documented;Not specified;;;Archaeological Sites;Quarry / Raw material source / Obsidian source / Chert source;;;;No;https://doi.org/10.30883/jba.v40i2.518 | https://doi.org/10.30883/jba.v30i1.385 | https://doi.org/10.30883/jba.v41i2.855 | https://doi.org/10.24164/pnk.v2i1.21;Description: i bekuan magma di luar bumi, biasanya berwarna abu-abu dan tidak tembus cahaya. Sumber bahan obsidian di daerah Nagerek ditemukan di Kampung Kendan. Berada di sebelah timur Gua Pawon dengan jarak lebih kurang 39 km dari Gua Pawon. Sumber bahan obsidian Kampung Rejeng (Garut) juga terletak di arah sebelah timur, dengan jarak lebih kurang 61 km dari Gua Pawon. 2 3 4 5 6 77 Foto 5. T emuan sisa perhiasan dari gigi ikan Hiu (shark, sp.) hasil ekskavasi di Gua Pawon. Sumber: Lutfi Y ondri, 2005. Sisa kehadiran atau indikasi pemanfaatan sumberdaya laut dalam lintas budaya prasejarah di Gua Pawon lebih jelas lagi dengan ditemukannya sisa-sisa artefak yang kuat digunakan sebagai perhiasan pad;;;;
drive-d35e84ded29c;Gua Pettae Kere;Maluku Islands;;;;;;No;Not documented;Not specified;;;Archaeological Sites;Cave / Gua / Liang / Ceruk;;;;No;https://doi.org/10.30883/jba.v40i2.518 | https://doi.org/10.30883/jba.v30i1.385 | https://doi.org/10.30883/jba.v41i2.855 | https://doi.org/10.24164/pnk.v2i1.21;Description: discoveries near Maros (South West Celebes). Laporan Tahunan Dinas Purbakala Republik Indonesia 1952, 22–35 (1952). 5. Samidi. Laporan hasil survai konservasi lukisan Gua Sumpang Bita dan pelaksanaan konservasi lukisan Gua Pettae Kere. Proyek pemugaran dan pemeliharaan peninggalan sejarah dan purbakala Sulawesi Selatan (1985). 6. Samidi. Laporan konservasi lukisan perahu/sampan di Gua Sumpang Bita (tahap awal) dan konservasi babi rusa di Gua Pettae K encapai lukisan. b. Restorasi Lukisan Bagian ujung kanan lukisan perahu / sampan yang masih kelihatan samar-samar telah direstorasi dengan dilukis ulang, agar tidak hilang sama sekali. Metode restorasinya sama dengan di Gua Pettae Kere, yakni dengan memberi warna dasar yang agak muda, kemudian diberi garis-garis pembatas / profil putus-putus. Bahan pewarna yang digunakan adalah haematit, dengan pelarut Paraloid B – 72 5 % dalam larutan ethyl;;;;
drive-869658ea4938;Gua Sahak;Maluku Islands;;;;;;No;Not documented;Not specified;;;Archaeological Sites;Cave / Gua / Liang / Ceruk;;;;No;https://doi.org/10.30883/jba.v40i2.518 | https://doi.org/10.30883/jba.v30i1.385 | https://doi.org/10.30883/jba.v41i2.855 | https://doi.org/10.24164/pnk.v2i1.21;"""Description: Gua Ilas Kenceng; 10. Gua Tewet, Gua Pindi, Gua Te'et, Gua Ujan, Gua Batu Aji; 11. Gua Tamrin, Gua Mentis, Gua Kayu Sampung, Gua lias Kecil, Gua Tangkorak, Gua Kurang Tahu, Gua Ham; 13. Gua Berak, GuaJufri, Gua Tembus, Gua Sahak; 14. Gua Lungun, Gua Keboboh, Gua Gudang Pecah, Gua Ampir Kosong, Liang Jon. The inset is shown as Figure 2. these sites consist only of lithic scatters that have not yielded organic remains suit­ able for 14C dating. S ang tampak dari udara. 1 – Ilas Kenceng. Dicapai lewat lembah di kanannya dan mendaki ke puncak. 2 – Gua Ham, saudara kembar Ilas Kenceng, yang baru ditemukan 3 tahun kemudian (h. 127). 3 – Gua Jufri (lihat h. 135). 4 – Gua Sahak. 5 – Bivak 2003, didirikan di kaki tebing. 6 – Mulut Gua Sedepan di kiri bawah. 7 - Gua Tanah Lihat, lorong luas di pertemuan gunung karts yang berpasir, jalan pintas untuk mendaki ke Ilas Kenceng. Tak ditemukan garca, | Keywords: Rock art site""";;;;
drive-17be9d5deb31;Gua Sedepan;Maluku Islands;;;;;;No;Not documented;Not specified;;;Archaeological Sites;Cave / Gua / Liang / Ceruk;;;;No;https://doi.org/10.30883/jba.v40i2.518 | https://doi.org/10.30883/jba.v30i1.385 | https://doi.org/10.30883/jba.v41i2.855 | https://doi.org/10.24164/pnk.v2i1.21;Description: i kanannya dan mendaki ke puncak. 2 – Gua Ham, saudara kembar Ilas Kenceng, yang baru ditemukan 3 tahun kemudian (h. 127). 3 – Gua Jufri (lihat h. 135). 4 – Gua Sahak. 5 – Bivak 2003, didirikan di kaki tebing. 6 – Mulut Gua Sedepan di kiri bawah. 7 - Gua Tanah Lihat, lorong luas di pertemuan gunung karts yang berpasir, jalan pintas untuk mendaki ke Ilas Kenceng. Tak ditemukan garca, namun ada keramik modern di pintu utara.Di dalamnya, berlanjut pe w Berjumpa dengan seekor kucing Bengale pada 2002 dalam hutan di kaki Ilas Kenceng: ia meronta, terperangkap jerat yang dipasang oleh penjaga Gua Sedepan yang belum juga terpuaskan walau sudah memungut habis-habisan sarang burung walet, tanpa peduli risiko kepunahan spesies itu. Macan kecil yang sangat langka itu (Tewet belum pernah melihat) adalah binatang malam yang hi;;;;
drive-77ca2010d199;Gua Sesak;Maluku Islands;;;;;;No;Not documented;Not specified;;;Archaeological Sites;Rockshelter / Rock shelter / Ceruk;;;;No;https://doi.org/10.30883/jba.v40i2.518 | https://doi.org/10.30883/jba.v30i1.385 | https://doi.org/10.30883/jba.v41i2.855 | https://doi.org/10.24164/pnk.v2i1.21;"""Description: anfaatan berlanjut hingga masa yang lebih kemudian. Hal ini jika melihat temuan yang bervariasi mulai dari alat kerang, fragmen gerabah dan fragmen keramik seperti yang ada di Gua Hao Pinalo dan Gua Hatu di Pulau Seram; Gua Sesak 1 dan Gua Sesak 2 di Kepulauan Banda. Keberadaan keramik asing merupakan artefak “termuda” yang ditemukan pada situs-situs gua di Maluku dan Maluku Utara. Keramik ini diduga datang ke wilayah ini melalui perdagangan yan t, yaitu dengan kategori temuan fragmen gerabah dan keramik asing. Situs-situs gua yang termasuk kategori keempat ini diantaranya, Gua Hao Pinalo, Gua Hatu, Gua Hatu Urang 1, Ceruk Lumoli, yang ada di Pulau Seram, serta Gua Sesak 1, dan Gua Sesak 2 yang ada di Pulau Ay, Kepulauan Banda. Hasil survei yang ada berdasarkan wawancara dengan masyarakat setempat di masing-masing situs gua tersebut menyebutkan bahwa dulunya gua dimanfaatkan sebagai tem""";;;;
drive-13fdd8f0fc49;Gua Siti Nafisah;Maluku Islands;;;;;;No;Excavated;Not specified;-2580000;1950;Archaeological Sites;Quarry / Raw material source / Obsidian source / Chert source;;;;No;https://doi.org/10.30883/jba.v40i2.518 | https://doi.org/10.30883/jba.v30i1.385 | https://doi.org/10.30883/jba.v41i2.855 | https://doi.org/10.24164/pnk.v2i1.21;Description: ther with occasional bones of fish and reptiles. Both marsupial species were present at the same time in another Gebe cave called Um Kapat Papo, and the wallaby also occurred (with a bandicoot) in mid‐Holocene layers in Gua Siti Nafisah on Halmahera. Both the wallaby and bandicoot are extinct in the northern Moluccas now and only the nocturnal cuscuses survive, but a direct date of about 750 years ago on a wallaby bone from Wetef suggests that their de ory terra australis 50 ? uncertain match 5 cm Golo Cave surface decorated body sherd of large jar (see photo for decoration) (scanned from a hand-drawn original) Figure 7.9 Pottery from Golo Cave (Gebe—upper vessel) and Gua Siti Nafisah Cave (eastern Halmahera—lower group). Shaded zone is red-slipped. Source: Peter Bellwood. | Keywords: Excavated site;;;;
drive-03c88dcca969;Gua Siti Nafisah F5;Maluku Islands;;;;;;No;Excavated;Not specified;;;Archaeological Sites;Cave / Gua / Liang / Ceruk;;;;No;https://doi.org/10.30883/jba.v40i2.518 | https://doi.org/10.30883/jba.v30i1.385 | https://doi.org/10.30883/jba.v41i2.855 | https://doi.org/10.24164/pnk.v2i1.21;"""Description: 4. The excavation of Gua Siti Nafisah, Kecamatan Weda, south-central Halmahera 65 terra australis 50 Table 4.1 Distribution of the contents of Gua Siti Nafisah F5–F8 by layer and depth in measured cm spits (commencing with spit A1). Siti Nafisah: layer/spit codes and depths from surface (NB: spits are not of equal thickness) C14 cal. BP (Anadara shell) Stone manuports, no./gm (F8 eo 1 by depth in cm. 58 Table 3.5 Distribution of the contents of Tanjung T ulang by depth in cm. 59 Table 3.6 Potsherd distributions by depth in cm in the Sambiki T ua site. 60 Table 4.1 Distribution of the contents of Gua Siti Nafisah F5–F8 by layer and depth in measured cm spits (commencing with spit A1). 65 Table 5.1 Distribution of cultural materials by layer and 5 cm spit in Uattamdi 1 (ch = charcoal, ms = marine shell; hb = human bone; te = Sus scr | Keywords: Excavated site""";;;;
drive-89e125f71b02;Gua Siti Nafisah. Source;Maluku Islands;;;;;;No;Not documented;Not specified;;;Archaeological Sites;Quarry / Raw material source / Obsidian source / Chert source;;;;No;https://doi.org/10.30883/jba.v40i2.518 | https://doi.org/10.30883/jba.v30i1.385 | https://doi.org/10.30883/jba.v41i2.855 | https://doi.org/10.24164/pnk.v2i1.21;"""Description: h details of the Northern Moluccas. Sites and site groups as follows: 1) Golo, Wetef and Buwawansi; 2) Um Kapat Papo and Kaitutsi; 3) Uattamdi and Bukit Keramat; 4) Sabatai Tua, Daeo, Tanjung Pinang, and Sambiki Tua; 5) Gua Siti Nafisah. Source: Peter Bellwood. h details of the Northern Moluccas. Sites and site groups as follows: 1) Golo, Wetef and Buwawansi; 2) Um Kapat Papo and Kaitutsi; 3) Uattamdi and Bukit Keramat; 4) Sabatai Tua, Daeo, Tanjung Pinang, and Sambiki Tua; 5) Gua Siti Nafisah. Source: Peter Bellwood. This content downloaded from 158.140.175.157 on Tue, 09 Nov 2021 09:57:03 UTC All use subject to""";;;;
drive-100be62ec522;Gua Siti Nafisah. The;Maluku Islands;;;;;;No;Not documented;Not specified;;;Archaeological Sites;Quarry / Raw material source / Obsidian source / Chert source;;;;No;https://doi.org/10.30883/jba.v40i2.518 | https://doi.org/10.30883/jba.v30i1.385 | https://doi.org/10.22459/TT.05.2015.12 | https://doi.org/10.1038/s41598-019-42946-9 | https://doi.org/10.1038/s41559-019-0902-6;Description: towards the northeastern limit of the arm. Weda WEDA BAY HALMAHERA 272 m 362 m 202 m Sungei Rote Gua Siti Na/f_isah coral limestone Tanjung Tilope Tilope Sosowomo 5 km N Figure 4.1 Map of the Weda region and location of Gua Siti Nafisah. The diagonally shaded area is limestone. Source: Peter Bellwood. The cave of Siti Nafisah is located near an agricultural field hamlet called Nusliko, about 5.5 km south of Weda (Fig. 4.1). The cave lies on the northern sid | Keywords: Cave;;;;
drive-9998b43965f1;Gua Solo Oti;Maluku Islands;;;;;;No;Not documented;Not specified;;;Archaeological Sites;Rockshelter / Rock shelter / Ceruk;;;;No;https://doi.org/10.30883/jba.v40i2.518 | https://doi.org/10.30883/jba.v30i1.385 | https://doi.org/10.1016/j.quaint.2010.01.018;Description: Sangia: Jurnal Penelitian Arkeologi Vol.3, No.1 ( Juni 2019): 57 - 77 Website: ISSN 2654-3524 (Online) ISSN 2613-8999 (Print) 58 surut. Gua Solo Oti merupakan tipe gua -ceruk (rock shelter) dan sering kali juga disebut dengan kata lain yaitu gua payung. Jika dilihat dari tipe gua -ceruk ( rock shelter) kadang difungsikan sebagai tempat hunian, tempat industri alat l dengan pertimbangan bahwa lokasi ini masih dapat diakses dengan mudah, terdapat bukti tinggalan arkeologi di dalam gua Solo Oti, lokasi ini masih sangat baru dan belum pernah dikaji oleh pihak m anapun. Oleh karena itu, Gua Solo Oti di Desa Taipa Kecamatan Lembo, Kabupaten Konawe Utara dipilih sebagai lokasi penelitian dengan judul “Fungsi Gua Solo Oti di Desa Taipa, Kecamatan Lembo, Kabupaten Konawe Utara. Adapun data yang di maksud dalam peneliti | Keywords: Rockshelter;;;;
drive-ebc73e3550ca;Gua Ta;Maluku Islands;;;;;;No;Not documented;Not specified;;;Archaeological Sites;Cave / Gua / Liang / Ceruk;;;;No;https://doi.org/10.30883/jba.v40i2.518 | https://doi.org/10.30883/jba.v30i1.385 | https://doi.org/10.30883/jba.v41i2.855 | https://doi.org/10.24164/pnk.v2i1.21;Description: ma nu sia ber to - peng) ber ba gai ukur an me na ri me nge li lingi ma ma - lia, mung kin ba bi hu tan, di bawah me na tap de ngan khid mat se so sok besar, la yak nya raja di se be lah kiri. Ke ka ya an se be nar nya Gua Ta mrin baru ter ung - kap se kem ba li aku ke Pran cis, ke ti ka meng olah foto di prog ram olah-ima ji. Mari kita ingat bahwa peng - amat an gam bar yang le tak nya sam pai se ting gi 10 meter di din ding yang run tuh, d mat. Bah kan corak itu cukup ba nyak ka re na ter hi tung lebih dari 50. Itu baru di Gua Tewet saja ( lihat tabel h. 111), serta dua pu luh an corak pe leng kap lain, yang ter - se bar baik di Gua Ham, Ilas Kenceng dan Gua Ta mrin mau pun di Gua Payau atau Liang Sara di gu nung lain. Bor neo, Me nying kap Gua Pra se ja rah Pohon Hayat Gua Tewet. Tatanan tera-tangan negatif, yang saling dihubungkan dan diindividualkan oleh corak pembeda, hamp | Keywords: Karst;;;;
drive-b549ec6dda5a;Gua Tamrin;Maluku Islands;;;;;;No;Not documented;Not specified;;;Archaeological Sites;Cave / Gua / Liang / Ceruk;;;;No;https://doi.org/10.30883/jba.v40i2.518 | https://doi.org/10.30883/jba.v30i1.385 | https://doi.org/10.30883/jba.v41i2.855 | https://doi.org/10.24164/pnk.v2i1.21;Description: Gua Kimanis, 93, 147–148, 279 Gua Lawa, 94, 120, 150, 286 Gua Pawon, 94, 96, 151 Gua Peraling, 138 Gua Pondok Selabe, 276 Guar Kepah, 91, 137–138 Gua Sireh, 256, 270, 273–274, 276, 325, Plate 8 Gua Siti Nafisah, 160–161 Gua Tamrin, Plate 2 Gua Tengkorak, 93, 148 Gua Tewet, Plate 2 Gunung Padang, 210–211, 321–323, 338 Gunung Piring, 279 Gunung Sewu, 67, 93, 96, 120, 140, 150, 275, 286 Guri Cave, 333–334 Hagop Bilo, 145–149 Halmahera, 12, 14, 21, 1 ographic glory in the pages of the wonderful book by Luc‐Henri Fage and Jean‐Michel Chazine (2010). A whole series of high‐level and fairly inaccessible caves (especially Gua Masri, Gua Saleh or Ilas Kenceng, Gua Tewet, Gua Tamrin, Gua Ham, Gua Jufri, Liang Karim, and Gua Harto) have red hematite decoration that includes paintings of bovines, deer, a possible tapir (extinct in Borneo), human stick figures with massive headdresses, and honeycombs | Keywords: Karst;;;;
drive-39a6d59900cb;Gua Taneti;Maluku Islands;;;;;;No;Not documented;Not specified;;;Archaeological Sites;Rockshelter / Rock shelter / Ceruk;;;;No;https://doi.org/10.30883/jba.v40i2.518 | https://doi.org/10.30883/jba.v30i1.385 | https://doi.org/10.30883/jba.v41i2.855 | https://doi.org/10.24164/pnk.v2i1.21;Description: ak melalui Kalimantan. Kemudian, menyeberang ke Sulawesi Tabel 1: Jumlah Data Situs Gua di Maluku dan Maluku Utara No. Lokasi Situs Temuan Fungsi Situs (Indikasi Awal) 1. Pulau Halmahera dan sekitarnya 1. Gua Waidoba 2. Gua Taneti 3. Gua Uattamdi 4. Ceruk T. Pinang 5. Gua Lolori 6. Gua Golo 7. Gua Gebe - Beliung persegi, belincung, kapak lonjong, sisa moluska, gerabah hias & polos, keramik. - Gerabah hias dan polos. - Gerabah slip merah, beliung nya, fungsi situs-situs gua yang ada di Maluku dan Maluku Utara, yaitu: 1. Situs-situs gua di Pulau Halmahera dan sekitarnya. Situs gua yang ada di Pulau Halmahera dan sekitarnya berjumlah lima situs, yaitu Gua Waidoba, Gua Taneti, Gua Uattamdi, Gua Tanjung Pinang, dan Gua Lolori. Keseluruhan situs gua tersebut menampilkan temuan dengan indikasi hunian. 2. Situs-situs gua di Pulau Seram. Situs gua yang ada di Pulau Seram lebih bervariasi, berjuml;;;;
drive-87c1e703adbe;Gua Tem;Maluku Islands;;;;;;No;Not documented;Not specified;;;Archaeological Sites;Cave / Gua / Liang / Ceruk;;;;No;https://doi.org/10.30883/jba.v40i2.518 | https://doi.org/10.30883/jba.v30i1.385 | https://doi.org/10.30883/jba.v41i2.855 | https://doi.org/10.24164/pnk.v2i1.21;Description: e nya ji kan ta ngan ber ujung kecil. Panen raya Ha ri-ha ri ber ikut nya, tim yang sama ber ha sil me - ne mu kan dua gua baru yang di hias, si tua si nya jauh lebih sulit, di se te ngah din ding ver ti kal di Gua Ham: Gua Tem bus (7 ta ngan ne ga tif ) dan Gua Sahak (68 ta ngan ne ga tif ). Di gua yang ter akhir, se buah ta - ngan jing ga yang sa ngat can tik me nam pak kan di ibu ja ri nya se sua tu yang tum buh, yang hanya dapat di je las eo lo gis dalam kerja sama de ngan Pusat Bumi dan Spe leo lo gi In do ne - sia. Ek splo ra si Lo bang Ton do yan, pe me ta an Gua Se de pan (8 km), pe ne mu an garca di Gua Berak, Gua Payau II, Gua Jufri, Gua Sahak, dan Gua Tem - bus. Pe ser ta: Pier re de Con inck, Jac ques Dur and, Luc-Hen ri Fage, Fa bi en Ho bléa, Geor ges Mar - bach, Je an-Fran ço is Per net te, Mi chel Per re au, “ - Toink” Fa tho el Rach man, Pindi Se tia wan. Agus tus:;;;;
drive-969ca76f2eff;Gua Trifi;Maluku Islands;;;;;;No;Not documented;Not specified;;;Archaeological Sites;Settlement / Habitation / Permukiman / Kampung;;;;No;https://doi.org/10.30883/jba.v40i2.518 | https://doi.org/10.30883/jba.v30i1.385 | https://doi.org/10.30883/jba.v41i2.855 | https://doi.org/10.24164/pnk.v2i1.21;Description: r ini tidak beraturan, ada yang dilangit-langit gua, dinding gua bagian luar dan celah batu. Keseluruhan gambar ini berwarna hitam, menggunakan bahan dasar arang. Dibuat dengan teknik gores, menggunakan tangan. c. Situs Gua Trifi Situs Trifi berada pada koordinat 03°34’55.8” Lintang Selatan dan 140°55’27.4” Bujur Timur. Situs ini berupa gua alam yang terbentuk dari batu gamping. Gua ini memiliki ciri fisik seperti tinggi gua tiga meter, lebar 21 ilakukan dengan cara garis/ lukis menggunakan tangan. 3.2 Makna dan Fungsi Simbol Lukisan Dinding Gua Beberapa makna motif lukisan dinding gua pada situs Gua Isisuk di Kampung Kibay Distrik Arso Timur dan Gua Erfe Hora, Gua Trifi, Gua Yakumbru dan Gua Yahoto di Kampung Yuruf Distrik Web, dapat dijelaskan sebagai berikut: a. Motif lukisa n tapak kaki dan tapak tangan Untuk motif lukisan berupa tapak kaki di Gua Isisuk, dan Gua Yahoto, kemungkinan;;;;
drive-c89206558849;Gua Uattamdi;Maluku Islands;;;;;;No;Not documented;Not specified;-4000;-350;Archaeological Sites;Rockshelter / Rock shelter / Ceruk;;;;No;https://doi.org/10.30883/jba.v40i2.518 | https://doi.org/10.30883/jba.v30i1.385 | https://doi.org/10.30883/jba.v41i2.855 | https://doi.org/10.24164/pnk.v2i1.21;Description: i Nusantara Lewoleba di Lembata dengan pertanggalan 2990±160 yang lalu (Grn-14308), Sulengwaseng di Solor, dan Melolo di Sumba. Bellwood 149 menemukan banyak situs Neolitik di Maluku, antara lain Gua Golo di Pulau Gebe, Gua Uattamdi di pulau Kayoa, Ceruk Tanjung Pinang di Morotai, dan Gua Siti Nafsiah di Halmahera. Ian Glover menemukan hunian Neolitik digua-gua di Timor Leste berupa jejak domestikasi babi Sus scrofa dan Sus celebensis bersama pecah imantan. Kemudian, menyeberang ke Sulawesi Tabel 1: Jumlah Data Situs Gua di Maluku dan Maluku Utara No. Lokasi Situs Temuan Fungsi Situs (Indikasi Awal) 1. Pulau Halmahera dan sekitarnya 1. Gua Waidoba 2. Gua Taneti 3. Gua Uattamdi 4. Ceruk T. Pinang 5. Gua Lolori 6. Gua Golo 7. Gua Gebe - Beliung persegi, belincung, kapak lonjong, sisa moluska, gerabah hias & polos, keramik. - Gerabah hias dan polos. - Gerabah slip merah, beliung persegi, da;;;;
drive-4dcd78a03f94;Here Sorot Entapa Cave;Maluku Islands;;;;;;No;Not documented;Not specified;;;Archaeological Sites;Cave / Gua / Liang / Ceruk;;;;No;https://doi.org/10.1080/15564894.2020.1868631 | https://doi.org/10.1080/15564894.2020.1868631 | https://doi.org/10.1088/1742-6596/1341/3/032047 | https://doi.org/10.1088/1742-6596/1341/3/032047;Description: Subsistence Strategy of Here Sorot Entapa Cave in Kisar Island, Maluku: Dwelling Site in Island with Limited Terrestrial Resources, Alifah, Mahirta 3 overview global environmental changes in the Southeast Wallacea region. Meanwhile, phytolith and starch data were ob Subsistence Strategy of Here Sorot Entapa Cave in Kisar Island, Maluku: Dwelling Site in Island with Limited Terrestrial Resources, Alifah, Mahirta 7 The results of phytoliths identification in the second layer indicate that there has been a significant environmenta | Keywords: Cave;;;;
drive-e423bbeb9a3f;Leang Arandangana;Maluku Islands;;;;;;No;Excavated;Not specified;;;Archaeological Sites;Burial / Cemetery / Kubur / Makam;;;;No;https://doi.org/10.3406/arch.1976.1271 | https://doi.org/10.1016/j.jasrep.2023.103871 | https://doi.org/10.1016/j.jasrep.2023.103871;Description: ay mould of around AD 1000 and a radiocarbon date of 510±80 BP (ANU 1516) on charcoal excavated from the top layer above the jar burials, Bellwood (1976:278) estimated the date of the burials to between AD 700 and 1200. Leang Arandangana on Kabaruan Island is another Metal Age site, and its lower layer is dated to around AD 1200 from marine shell samples. The site also yielded a number of Rarangunusa-style potsherds from its two layers and two pieces of might date to after the Song Dynasty, because there are no photographs, drawings or detailed descriptions of these excavated trade ceramics in Bellwood (1976). The only tradewares identified from younger sites including Leang Arandangana (Tanudirjo 2001) and Bukit Tiwing are represented by late Ming to Qing sherds recovered from the upper layers. The numbers of these trade ceramics are much larger than older ceramic types, which might sug | Keywords: Excavated site;;;;
drive-314de3f0fa65;Liang Fanga;Maluku Islands;;;;;;No;Not documented;Not specified;;;Archaeological Sites;Rockshelter / Rock shelter / Ceruk;;;;No;https://doi.org/10.1016/j.jhevol.2006.08.011 | https://doi.org/10.1080/15564894.2022.2108947.] | https://doi.org/10.5281/zenodo.3929274;Description: ed between 800-1,000 BP. In addition, Lape et al. (2017) released a publication showing the dating of marine shell samples at a rock shelter located in East Seram. Rock shelters named Liang Kilbidi, Liang Watu Tewa, and Liang Fanga 2 are estimated to be 3,607, 4,086, and 4,850 years. These numbers were calibrate d by Kaharudin, Alifah, Ramadhan, & Kealy (2020), resulting in an age range between 5,135 BP to 3,186 BP. Tracing the Oral Trad ition of tusua Seram Radiocarbon D-AMS- 013933 Marine shell 1092 24 641–417 46 81 Batususu Ambon Radiocarbon Beta-73693 – 780 60 898–44 b 45 82 Liang Watu Tewa Seram Radiocarbon D-AMS- 013930 Marine shell 4086 28 4118–3775 46 83 Liang Fanga 2 Seram Radiocarbon D-AMS- 013929 Marine shell 4850 28 5135–4780 46 84 Liang Kilbidi Seram Radiocarbon D-AMS- 013931 Marine shell 3607 27 3479–3186 46 85 Liang Nabulei Lisa Kobroor (Aru) Radiocarbon OZF518 Eggshell 13 | Keywords: Rockshelter;;;;
drive-0bff7017451b;Liang Kacamata;Maluku Islands;;;;;;No;Not documented;Not specified;;;Archaeological Sites;Cave / Gua / Liang / Ceruk;;;;No;https://doi.org/10.1016/j.jhevol.2006.08.011 | https://doi.org/10.1080/15564894.2022.2108947.] | https://doi.org/10.5281/zenodo.3929274;Description: 151 data hunian prasejarah yang cukup intensif, berupa pecahan batu (tatal), serpih, bilah, dan beberapa fragmen gerabah. Artinya, Situs Liang Kacamata memang digunakan sebagai tempat tinggal pada masa prasejarah. Sementara tespit yang dilakukan pada ruangan di dalam Liang Susu, tidak menemukan artefak apapun. Kenyataan ini kemungkinan besar dipengaruhi oleh morfologi 150 yang sama, hanya berbeda bukit karst dengan jarak lurus sekitar 1 km. Gambar perahu di Situs Liang Kacamata dilukiskan pada dinding gua sebelah kiri saat kita memasuki situs. Kondisi gambar-gambar perahu di sini sangat memprihatinkan, karena sudah bercampur dengan coretan vandalisme lainnya. Ada 3 buah gambar perahu dengan wa | Keywords: Karst;;;;
